A1: <!-- google_ad_client = "ca-pub-0120177304734599"; /* top728x90 */ google_ad_slot = "4247478622"; google_ad_width = 728; google_ad_height = 90; //--> | C1: <!-- google_ad_client = "ca-pub-0120177304734599"; /* top160x90 */ google_ad_slot = "4107877822"; google_ad_width = 160; google_ad_height = 90; //-->

A1: =1000/1000 -> 1.000 | B1: =LOG(A1) -> 0.00000000 | E1: 2.00 | F1: =LOG(E1)-FLOOR(LOG(E1),1) -> 0.3010299956639812 | G1: 3.00 | H1: =LOG(G1)-FLOOR(LOG(G1),1) -> 0.47712125471966244 | I1: 4.00 | J1: =LOG(I1)-FLOOR(LOG(I1),1) -> 0.6020599913279624 | K1: 5.00 | L1: =LOG(K1)-FLOOR(LOG(K1),1) -> 0.69897000433601886 | M1: 6.00 | N1: =LOG(M1)-FLOOR(LOG(M1),1) -> 0.77815125038364363 | O1: 7.00 | P1: =LOG(O1)-FLOOR(LOG(O1),1) -> 0.84509804001425681 | Q1: 8.00 | R1: =LOG(Q1)-FLOOR(LOG(Q1),1) -> 0.90308998699194354 | S1: 9.00 | T1: =LOG(S1)-FLOOR(LOG(S1),1) -> 0.95424250943932487
A2: =A1+0.001 -> 1.0009999999999999 | B2: =LOG(A2) -> 4.340774793185929E-4 | E2: 2.01 | F2: =LOG(E2)-FLOOR(LOG(E2),1) -> 0.30319605742048883 | G2: 3.01 | H2: =LOG(G2)-FLOOR(LOG(G2),1) -> 0.47856649559384334 | I2: 4.01 | J2: =LOG(I2)-FLOOR(LOG(I2),1) -> 0.60314437262018228 | K2: 5.01 | L2: =LOG(K2)-FLOOR(LOG(K2),1) -> 0.69983772586724569 | M2: 6.01 | N2: =LOG(M2)-FLOOR(LOG(M2),1) -> 0.77887447200273952 | O2: 7.01 | P2: =LOG(O2)-FLOOR(LOG(O2),1) -> 0.84571801796665869 | Q2: 8.01 | R2: =LOG(Q2)-FLOOR(LOG(Q2),1) -> 0.90363251608423767 | S2: 9.01 | T2: =LOG(S2)-FLOOR(LOG(S2),1) -> 0.95472479097906293
A3: =A2+0.001 -> 1.0019999999999998 | B3: =LOG(A3) -> 8.6772153122681699E-4 | E3: 2.02 | F3: =LOG(E3)-FLOOR(LOG(E3),1) -> 0.30535136944662378 | G3: 3.02 | H3: =LOG(G3)-FLOOR(LOG(G3),1) -> 0.48000694295715063 | I3: 4.02 | J3: =LOG(I3)-FLOOR(LOG(I3),1) -> 0.60422605308446997 | K3: 5.02 | L3: =LOG(K3)-FLOOR(LOG(K3),1) -> 0.70070371714501933 | M3: 6.02 | N3: =LOG(M3)-FLOOR(LOG(M3),1) -> 0.77959649125782449 | O3: 7.02 | P3: =LOG(O3)-FLOOR(LOG(O3),1) -> 0.84633711212980522 | Q3: 8.02 | R3: =LOG(Q3)-FLOOR(LOG(Q3),1) -> 0.90417436828416353 | S3: 9.02 | T3: =LOG(S3)-FLOOR(LOG(S3),1) -> 0.95520653754194174
A4: =A3+0.001 -> 1.0029999999999997 | B4: =LOG(A4) -> 1.3009330204179757E-3 | E4: 2.03 | F4: =LOG(E4)-FLOOR(LOG(E4),1) -> 0.30749603791321289 | G4: 3.03 | H4: =LOG(G4)-FLOOR(LOG(G4),1) -> 0.48144262850230496 | I4: 4.03 | J4: =LOG(I4)-FLOOR(LOG(I4),1) -> 0.60530504614110947 | K4: 5.03 | L4: =LOG(K4)-FLOOR(LOG(K4),1) -> 0.70156798505592743 | M4: 6.03 | N4: =LOG(M4)-FLOOR(LOG(M4),1) -> 0.78031731214015132 | O4: 7.03 | P4: =LOG(O4)-FLOOR(LOG(O4),1) -> 0.84695532501982396 | Q4: 8.03 | R4: =LOG(Q4)-FLOOR(LOG(Q4),1) -> 0.90471554527868092 | S4: 9.03 | T4: =LOG(S4)-FLOOR(LOG(S4),1) -> 0.95568775031350572
A5: =A4+0.001 -> 1.0039999999999996 | B5: =LOG(A5) -> 1.7337128090003393E-3 | E5: 2.04 | F5: =LOG(E5)-FLOOR(LOG(E5),1) -> 0.30963016742589877 | G5: 3.04 | H5: =LOG(G5)-FLOOR(LOG(G5),1) -> 0.48287358360875376 | I5: 4.04 | J5: =LOG(I5)-FLOOR(LOG(I5),1) -> 0.60638136511060492 | K5: 5.04 | L5: =LOG(K5)-FLOOR(LOG(K5),1) -> 0.70243053644552533 | M5: 6.04 | N5: =LOG(M5)-FLOOR(LOG(M5),1) -> 0.78103693862113188 | O5: 7.04 | P5: =LOG(O5)-FLOOR(LOG(O5),1) -> 0.84757265914211222 | Q5: 8.04 | R5: =LOG(Q5)-FLOOR(LOG(Q5),1) -> 0.90525604874845123 | S5: 9.04 | T5: =LOG(S5)-FLOOR(LOG(S5),1) -> 0.95616843047536326
A6: =A5+0.001 -> 1.0049999999999999 | B6: =LOG(A6) -> 2.1660617565074382E-3 | E6: 2.05 | F6: =LOG(E6)-FLOOR(LOG(E6),1) -> 0.31175386105575426 | G6: 3.05 | H6: =LOG(G6)-FLOOR(LOG(G6),1) -> 0.48429983934678583 | I6: 4.05 | J6: =LOG(I6)-FLOOR(LOG(I6),1) -> 0.60745502321466849 | K6: 5.05 | L6: =LOG(K6)-FLOOR(LOG(K6),1) -> 0.70329137811866138 | M6: 6.05 | N6: =LOG(M6)-FLOOR(LOG(M6),1) -> 0.78175537465246892 | O6: 7.05 | P6: =LOG(O6)-FLOOR(LOG(O6),1) -> 0.84818911699139865 | Q6: 8.05 | R6: =LOG(Q6)-FLOOR(LOG(Q6),1) -> 0.90579588036786851 | S6: 9.05 | T6: =LOG(S6)-FLOOR(LOG(S6),1) -> 0.9566485792052033
A7: =A6+0.001 -> 1.0059999999999993 | B7: =LOG(A7) -> 2.5979807199083072E-3 | E7: 2.06 | F7: =LOG(E7)-FLOOR(LOG(E7),1) -> 0.31386722036915343 | G7: 3.06 | H7: =LOG(G7)-FLOOR(LOG(G7),1) -> 0.48572142648158001 | I7: 4.06 | J7: =LOG(I7)-FLOOR(LOG(I7),1) -> 0.60852603357719404 | K7: 5.06 | L7: =LOG(K7)-FLOOR(LOG(K7),1) -> 0.70415051683979912 | M7: 6.06 | N7: =LOG(M7)-FLOOR(LOG(M7),1) -> 0.78247262416628616 | O7: 7.06 | P7: =LOG(O7)-FLOOR(LOG(O7),1) -> 0.84880470105180372 | Q7: 8.06 | R7: =LOG(Q7)-FLOOR(LOG(Q7),1) -> 0.90633504180509072 | S7: 9.06 | T7: =LOG(S7)-FLOOR(LOG(S7),1) -> 0.95712819767681312
A8: =A7+0.001 -> 1.0069999999999992 | B8: =LOG(A8) -> 3.0294705536176745E-3 | E8: 2.07 | F8: =LOG(E8)-FLOOR(LOG(E8),1) -> 0.31597034545691771 | G8: 3.07 | H8: =LOG(G8)-FLOOR(LOG(G8),1) -> 0.48713837547718647 | I8: 4.07 | J8: =LOG(I8)-FLOOR(LOG(I8),1) -> 0.60959440922522001 | K8: 5.07 | L8: =LOG(K8)-FLOOR(LOG(K8),1) -> 0.70500795933333604 | M8: 6.07 | N8: =LOG(M8)-FLOOR(LOG(M8),1) -> 0.78318869107525757 | O8: 7.07 | P8: =LOG(O8)-FLOOR(LOG(O8),1) -> 0.84941941379689945 | Q8: 8.07 | R8: =LOG(Q8)-FLOOR(LOG(Q8),1) -> 0.90687353472207044 | S8: 9.07 | T8: =LOG(S8)-FLOOR(LOG(S8),1) -> 0.95760728706009524
A9: =A8+0.001 -> 1.0079999999999991 | B9: =LOG(A9) -> 3.4605321095061065E-3 | E9: 2.08 | F9: =LOG(E9)-FLOOR(LOG(E9),1) -> 0.31806333496276157 | G9: 3.08 | H9: =LOG(G9)-FLOOR(LOG(G9),1) -> 0.48855071650044429 | I9: 4.08 | J9: =LOG(I9)-FLOOR(LOG(I9),1) -> 0.61066016308987991 | K9: 5.08 | L9: =LOG(K9)-FLOOR(LOG(K9),1) -> 0.70586371228391931 | M9: 6.08 | N9: =LOG(M9)-FLOOR(LOG(M9),1) -> 0.78390357927273491 | O9: 7.08 | P9: =LOG(O9)-FLOOR(LOG(O9),1) -> 0.85003325768976901 | Q9: 8.08 | R9: =LOG(Q9)-FLOOR(LOG(Q9),1) -> 0.90741136077458617 | S9: 9.08 | T9: =LOG(S9)-FLOOR(LOG(S9),1) -> 0.95808584852108514
A10: =A9+0.001 -> 1.008999999999999 | B10: =LOG(A10) -> 3.891166236910095E-3 | E10: 2.09 | F10: =LOG(E10)-FLOOR(LOG(E10),1) -> 0.32014628611105395 | G10: 3.09 | H10: =LOG(G10)-FLOOR(LOG(G10),1) -> 0.48995847942483461 | I10: 4.09 | J10: =LOG(I10)-FLOOR(LOG(I10),1) -> 0.61172330800734176 | K10: 5.09 | L10: =LOG(K10)-FLOOR(LOG(K10),1) -> 0.70671778233675875 | M10: 6.09 | N10: =LOG(M10)-FLOOR(LOG(M10),1) -> 0.78461729263287538 | O10: 7.09 | P10: =LOG(O10)-FLOOR(LOG(O10),1) -> 0.85064623518306648 | Q10: 8.09 | R10: =LOG(Q10)-FLOOR(LOG(Q10),1) -> 0.90794852161227224 | S10: 9.09 | T10: =LOG(S10)-FLOOR(LOG(S10),1) -> 0.95856388322196739
A11: =A10+0.001 -> 1.010 | B11: =LOG(A11) -> 4.3213737826421003E-3 | C11: 1.10 | D11: =LOG(C11)-FLOOR(LOG(C11),1) -> 4.1392685158225077E-2 | E11: 2.10 | F11: =LOG(E11)-FLOOR(LOG(E11),1) -> 0.3222192947339193 | G11: 3.10 | H11: =LOG(G11)-FLOOR(LOG(G11),1) -> 0.49136169383427269 | I11: 4.10 | J11: =LOG(I11)-FLOOR(LOG(I11),1) -> 0.61278385671973545 | K11: 5.10 | L11: =LOG(K11)-FLOOR(LOG(K11),1) -> 0.70757017609793638 | M11: 6.10 | N11: =LOG(M11)-FLOOR(LOG(M11),1) -> 0.78532983501076703 | O11: 7.10 | P11: =LOG(O11)-FLOOR(LOG(O11),1) -> 0.85125834871907524 | Q11: 8.10 | R11: =LOG(Q11)-FLOOR(LOG(Q11),1) -> 0.90848501887864974 | S11: 9.10 | T11: =LOG(S11)-FLOOR(LOG(S11),1) -> 0.95904139232109353
A12: =A11+0.001 -> 1.0109999999999988 | B12: =LOG(A12) -> 4.7511555910005427E-3 | C12: 1.11 | D12: =LOG(C12)-FLOOR(LOG(C12),1) -> 4.5322978786657475E-2 | E12: 2.11 | F12: =LOG(E12)-FLOOR(LOG(E12),1) -> 0.32428245529769262 | G12: 3.11 | H12: =LOG(G12)-FLOOR(LOG(G12),1) -> 0.4927603890268375 | I12: 4.11 | J12: =LOG(I12)-FLOOR(LOG(I12),1) -> 0.61384182187606928 | K12: 5.11 | L12: =LOG(K12)-FLOOR(LOG(K12),1) -> 0.70842090013471271 | M12: 6.11 | N12: =LOG(M12)-FLOOR(LOG(M12),1) -> 0.78604121024255424 | O12: 7.11 | P12: =LOG(O12)-FLOOR(LOG(O12),1) -> 0.85186960072976636 | Q12: 8.11 | R12: =LOG(Q12)-FLOOR(LOG(Q12),1) -> 0.90902085421115597 | S12: 9.11 | T12: =LOG(S12)-FLOOR(LOG(S12),1) -> 0.95951837697299824
A13: =A12+0.001 -> 1.0119999999999987 | B13: =LOG(A13) -> 5.1805125037797427E-3 | C13: 1.12 | D13: =LOG(C13)-FLOOR(LOG(C13),1) -> 4.9218022670181653E-2 | E13: 2.12 | F13: =LOG(E13)-FLOOR(LOG(E13),1) -> 0.32633586092875144 | G13: 3.12 | H13: =LOG(G13)-FLOOR(LOG(G13),1) -> 0.49415459401844281 | I13: 4.12 | J13: =LOG(I13)-FLOOR(LOG(I13),1) -> 0.61489721603313463 | K13: 5.12 | L13: =LOG(K13)-FLOOR(LOG(K13),1) -> 0.70926996097583073 | M13: 6.12 | N13: =LOG(M13)-FLOOR(LOG(M13),1) -> 0.78675142214556115 | O13: 7.12 | P13: =LOG(O13)-FLOOR(LOG(O13),1) -> 0.85247999363685634 | Q13: 8.12 | R13: =LOG(Q13)-FLOOR(LOG(Q13),1) -> 0.90955602924117529 | S13: 9.12 | T13: =LOG(S13)-FLOOR(LOG(S13),1) -> 0.95999483832841614
A14: =A13+0.001 -> 1.0129999999999986 | B14: =LOG(A14) -> 5.6094453602798149E-3 | C14: 1.13 | D14: =LOG(C14)-FLOOR(LOG(C14),1) -> 5.3078443483419682E-2 | E14: 2.13 | F14: =LOG(E14)-FLOOR(LOG(E14),1) -> 0.32837960343873768 | G14: 3.13 | H14: =LOG(G14)-FLOOR(LOG(G14),1) -> 0.49554433754644844 | I14: 4.13 | J14: =LOG(I14)-FLOOR(LOG(I14),1) -> 0.61595005165640104 | K14: 5.13 | L14: =LOG(K14)-FLOOR(LOG(K14),1) -> 0.71011736511181622 | M14: 6.13 | N14: =LOG(M14)-FLOOR(LOG(M14),1) -> 0.78746047451841505 | O14: 7.13 | P14: =LOG(O14)-FLOOR(LOG(O14),1) -> 0.85308952985186559 | Q14: 8.13 | R14: =LOG(Q14)-FLOOR(LOG(Q14),1) -> 0.91009054559406821 | S14: 9.13 | T14: =LOG(S14)-FLOOR(LOG(S14),1) -> 0.96047077753429899
A15: =A14+0.001 -> 1.0139999999999985 | B15: =LOG(A15) -> 6.0379549973165105E-3 | C15: 1.14 | D15: =LOG(C15)-FLOOR(LOG(C15),1) -> 5.6904851336472557E-2 | E15: 2.14 | F15: =LOG(E15)-FLOOR(LOG(E15),1) -> 0.33041377334919086 | G15: 3.14 | H15: =LOG(G15)-FLOOR(LOG(G15),1) -> 0.49692964807321494 | I15: 4.14 | J15: =LOG(I15)-FLOOR(LOG(I15),1) -> 0.61700034112089897 | K15: 5.14 | L15: =LOG(K15)-FLOOR(LOG(K15),1) -> 0.71096311899527576 | M15: 6.14 | N15: =LOG(M15)-FLOOR(LOG(M15),1) -> 0.78816837114116767 | O15: 7.14 | P15: =LOG(O15)-FLOOR(LOG(O15),1) -> 0.85369821177617433 | Q15: 8.14 | R15: =LOG(Q15)-FLOOR(LOG(Q15),1) -> 0.91062440488920127 | S15: 9.14 | T15: =LOG(S15)-FLOOR(LOG(S15),1) -> 0.96094619573383144
A16: =A15+0.001 -> 1.0149999999999999 | B16: =LOG(A16) -> 6.466042249231016E-3 | C16: 1.15 | D16: =LOG(C16)-FLOOR(LOG(C16),1) -> 6.069784035361165E-2 | E16: 2.15 | F16: =LOG(E16)-FLOOR(LOG(E16),1) -> 0.33243845991560533 | G16: 3.15 | H16: =LOG(G16)-FLOOR(LOG(G16),1) -> 0.49831055378960049 | I16: 4.15 | J16: =LOG(I16)-FLOOR(LOG(I16),1) -> 0.61804809671209271 | K16: 5.15 | L16: =LOG(K16)-FLOOR(LOG(K16),1) -> 0.71180722904119109 | M16: 6.15 | N16: =LOG(M16)-FLOOR(LOG(M16),1) -> 0.7888751157754168 | O16: 7.15 | P16: =LOG(O16)-FLOOR(LOG(O16),1) -> 0.85430604180108061 | Q16: 8.15 | R16: =LOG(Q16)-FLOOR(LOG(Q16),1) -> 0.91115760873997664 | S16: 9.15 | T16: =LOG(S16)-FLOOR(LOG(S16),1) -> 0.96142109406644827
A17: =A16+0.001 -> 1.0159999999999982 | B17: =LOG(A17) -> 6.8937079478996969E-3 | C17: 1.16 | D17: =LOG(C17)-FLOOR(LOG(C17),1) -> 6.445798922691845E-2 | E17: 2.16 | F17: =LOG(E17)-FLOOR(LOG(E17),1) -> 0.3344537511509309 | G17: 3.16 | H17: =LOG(G17)-FLOOR(LOG(G17),1) -> 0.49968708261840383 | I17: 4.16 | J17: =LOG(I17)-FLOOR(LOG(I17),1) -> 0.61909333062674277 | K17: 5.16 | L17: =LOG(K17)-FLOOR(LOG(K17),1) -> 0.71264970162721142 | M17: 6.16 | N17: =LOG(M17)-FLOOR(LOG(M17),1) -> 0.78958071216442549 | O17: 7.16 | P17: =LOG(O17)-FLOOR(LOG(O17),1) -> 0.8549130223078556 | Q17: 8.16 | R17: =LOG(Q17)-FLOOR(LOG(Q17),1) -> 0.91169015875386117 | S17: 9.16 | T17: =LOG(S17)-FLOOR(LOG(S17),1) -> 0.96189547366785044
A18: =A17+0.001 -> 1.0169999999999981 | B18: =LOG(A18) -> 7.3209529227437975E-3 | C18: 1.17 | D18: =LOG(C18)-FLOOR(LOG(C18),1) -> 6.8185861746161619E-2 | E18: 2.17 | F18: =LOG(E18)-FLOOR(LOG(E18),1) -> 0.33645973384852951 | G18: 3.17 | H18: =LOG(G18)-FLOOR(LOG(G18),1) -> 0.50105926221775143 | I18: 4.17 | J18: =LOG(I18)-FLOOR(LOG(I18),1) -> 0.62013605497375746 | K18: 5.17 | L18: =LOG(K18)-FLOOR(LOG(K18),1) -> 0.71349054309394255 | M18: 6.17 | N18: =LOG(M18)-FLOOR(LOG(M18),1) -> 0.79028516403324167 | O18: 7.17 | P18: =LOG(O18)-FLOOR(LOG(O18),1) -> 0.85551915566780012 | Q18: 8.17 | R18: =LOG(Q18)-FLOOR(LOG(Q18),1) -> 0.9122220565324155 | S18: 9.17 | T18: =LOG(S18)-FLOOR(LOG(S18),1) -> 0.96236933567002114
A19: =A18+0.001 -> 1.017999999999998 | B19: =LOG(A19) -> 7.7477780007390957E-3 | C19: 1.18 | D19: =LOG(C19)-FLOOR(LOG(C19),1) -> 7.1882007306125359E-2 | E19: 2.18 | F19: =LOG(E19)-FLOOR(LOG(E19),1) -> 0.33845649360460484 | G19: 3.18 | H19: =LOG(G19)-FLOOR(LOG(G19),1) -> 0.50242711998443268 | I19: 4.18 | J19: =LOG(I19)-FLOOR(LOG(I19),1) -> 0.62117628177503514 | K19: 5.18 | L19: =LOG(K19)-FLOOR(LOG(K19),1) -> 0.71432975974523305 | M19: 6.18 | N19: =LOG(M19)-FLOOR(LOG(M19),1) -> 0.79098847508881587 | O19: 7.18 | P19: =LOG(O19)-FLOOR(LOG(O19),1) -> 0.85612444424230028 | Q19: 8.18 | R19: =LOG(Q19)-FLOOR(LOG(Q19),1) -> 0.91275330367132301 | S19: 9.18 | T19: =LOG(S19)-FLOOR(LOG(S19),1) -> 0.96284268120124239
A20: =A19+0.001 -> 1.0189999999999979 | B20: =LOG(A20) -> 8.1741840064255035E-3 | C20: 1.19 | D20: =LOG(C20)-FLOOR(LOG(C20),1) -> 7.554696139253074E-2 | E20: 2.19 | F20: =LOG(E20)-FLOOR(LOG(E20),1) -> 0.34044411484011833 | G20: 3.19 | H20: =LOG(G20)-FLOOR(LOG(G20),1) -> 0.50379068305718111 | I20: 4.19 | J20: =LOG(I20)-FLOOR(LOG(I20),1) -> 0.62221402296629535 | K20: 5.19 | L20: =LOG(K20)-FLOOR(LOG(K20),1) -> 0.71516735784845786 | M20: 6.19 | N20: =LOG(M20)-FLOOR(LOG(M20),1) -> 0.79169064902011799 | O20: 7.19 | P20: =LOG(O20)-FLOOR(LOG(O20),1) -> 0.85672889038288258 | Q20: 8.19 | R20: =LOG(Q20)-FLOOR(LOG(Q20),1) -> 0.9132839017604184 | S20: 9.19 | T20: =LOG(S20)-FLOOR(LOG(S20),1) -> 0.96331551138611127
A21: =A20+0.001 -> 1.020 | B21: =LOG(A21) -> 8.6001717619166237E-3 | C21: 1.20 | D21: =LOG(C21)-FLOOR(LOG(C21),1) -> 7.9181246047624818E-2 | E21: 2.20 | F21: =LOG(E21)-FLOOR(LOG(E21),1) -> 0.34242268082220628 | G21: 3.20 | H21: =LOG(G21)-FLOOR(LOG(G21),1) -> 0.50514997831990605 | I21: 4.20 | J21: =LOG(I21)-FLOOR(LOG(I21),1) -> 0.62324929039790045 | K21: 5.20 | L21: =LOG(K21)-FLOOR(LOG(K21),1) -> 0.71600334363479923 | M21: 6.20 | N21: =LOG(M21)-FLOOR(LOG(M21),1) -> 0.79239168949825389 | O21: 7.20 | P21: =LOG(O21)-FLOOR(LOG(O21),1) -> 0.85733249643126852 | Q21: 8.20 | R21: =LOG(Q21)-FLOOR(LOG(Q21),1) -> 0.91381385238371671 | S21: 9.20 | T21: =LOG(S21)-FLOOR(LOG(S21),1) -> 0.96378782734555524
A22: =A21+0.001 -> 1.0209999999999977 | B22: =LOG(A22) -> 9.0257420869092643E-3 | C22: 1.21 | D22: =LOG(C22)-FLOOR(LOG(C22),1) -> 8.2785370316450071E-2 | E22: 2.21 | F22: =LOG(E22)-FLOOR(LOG(E22),1) -> 0.34439227368511072 | G22: 3.21 | H22: =LOG(G22)-FLOOR(LOG(G22),1) -> 0.5065050324048721 | I22: 4.21 | J22: =LOG(I22)-FLOOR(LOG(I22),1) -> 0.62428209583566829 | K22: 5.21 | L22: =LOG(K22)-FLOOR(LOG(K22),1) -> 0.71683772329952444 | M22: 6.21 | N22: =LOG(M22)-FLOOR(LOG(M22),1) -> 0.7930916001765802 | O22: 7.21 | P22: =LOG(O22)-FLOOR(LOG(O22),1) -> 0.85793526471942905 | Q22: 8.21 | R22: =LOG(Q22)-FLOOR(LOG(Q22),1) -> 0.91434315711944081 | S22: 9.21 | T22: =LOG(S22)-FLOOR(LOG(S22),1) -> 0.96425963019684902
A23: =A22+0.001 -> 1.0219999999999976 | B23: =LOG(A23) -> 9.4508957986928974E-3 | C23: 1.22 | D23: =LOG(C23)-FLOOR(LOG(C23),1) -> 8.6359830674748214E-2 | E23: 2.21999999999999 | F23: =LOG(E23)-FLOOR(LOG(E23),1) -> 0.34635297445063667 | G23: 3.21999999999999 | H23: =LOG(G23)-FLOOR(LOG(G23),1) -> 0.50785587169582957 | I23: 4.22 | J23: =LOG(I23)-FLOOR(LOG(I23),1) -> 0.62531245096167387 | K23: 5.22 | L23: =LOG(K23)-FLOOR(LOG(K23),1) -> 0.71767050300226209 | M23: 6.22 | N23: =LOG(M23)-FLOOR(LOG(M23),1) -> 0.79379038469081864 | O23: 7.22 | P23: =LOG(O23)-FLOOR(LOG(O23),1) -> 0.85853719756963909 | Q23: 8.22 | R23: =LOG(Q23)-FLOOR(LOG(Q23),1) -> 0.91487181754005042 | S23: 9.22 | T23: =LOG(S23)-FLOOR(LOG(S23),1) -> 0.96473092105362934
A24: =A23+0.001 -> 1.0229999999999975 | B24: =LOG(A24) -> 9.8756337121590817E-3 | C24: 1.23 | D24: =LOG(C24)-FLOOR(LOG(C24),1) -> 8.9905111439397931E-2 | E24: 2.23 | F24: =LOG(E24)-FLOOR(LOG(E24),1) -> 0.34830486304816066 | G24: 3.23 | H24: =LOG(G24)-FLOOR(LOG(G24),1) -> 0.50920252233110286 | I24: 4.23 | J24: =LOG(I24)-FLOOR(LOG(I24),1) -> 0.6263403673750424 | K24: 5.23 | L24: =LOG(K24)-FLOOR(LOG(K24),1) -> 0.71850168886727428 | M24: 6.23 | N24: =LOG(M24)-FLOOR(LOG(M24),1) -> 0.79448804665916961 | O24: 7.23 | P24: =LOG(O24)-FLOOR(LOG(O24),1) -> 0.85913829729453084 | Q24: 8.23 | R24: =LOG(Q24)-FLOOR(LOG(Q24),1) -> 0.91539983521226986 | S24: 9.23 | T24: =LOG(S24)-FLOOR(LOG(S24),1) -> 0.96520170102591207
A25: =A24+0.001 -> 1.0239999999999974 | B25: =LOG(A25) -> 1.0299956639810832E-2 | C25: 1.24 | D25: =LOG(C25)-FLOOR(LOG(C25),1) -> 9.3421685162235063E-2 | E25: 2.23999999999999 | F25: =LOG(E25)-FLOOR(LOG(E25),1) -> 0.35024801833416086 | G25: 3.23999999999999 | H25: =LOG(G25)-FLOOR(LOG(G25),1) -> 0.51054501020661081 | I25: 4.2399999999999904 | J25: =LOG(I25)-FLOOR(LOG(I25),1) -> 0.6273658565927317 | K25: 5.2399999999999904 | L25: =LOG(K25)-FLOOR(LOG(K25),1) -> 0.71933128698372584 | M25: 6.2399999999999904 | N25: =LOG(M25)-FLOOR(LOG(M25),1) -> 0.79518458968242334 | O25: 7.2399999999999904 | P25: =LOG(O25)-FLOOR(LOG(O25),1) -> 0.85973856619714628 | Q25: 8.2399999999999896 | R25: =LOG(Q25)-FLOOR(LOG(Q25),1) -> 0.91592721169711522 | S25: 9.2399999999999896 | T25: =LOG(S25)-FLOOR(LOG(S25),1) -> 0.96567197122010617
A26: =A25+0.001 -> 1.0249999999999999 | B26: =LOG(A26) -> 1.0723865391771937E-2 | C26: 1.25 | D26: =LOG(C26)-FLOOR(LOG(C26),1) -> 9.691001300805642E-2 | E26: 2.25 | F26: =LOG(E26)-FLOOR(LOG(E26),1) -> 0.35218251811136247 | G26: 3.25 | H26: =LOG(G26)-FLOOR(LOG(G26),1) -> 0.51188336097887432 | I26: 4.2499999999999902 | J26: =LOG(I26)-FLOOR(LOG(I26),1) -> 0.62838893005031049 | K26: 5.2499999999999902 | L26: =LOG(K26)-FLOOR(LOG(K26),1) -> 0.72015930340595602 | M26: 6.2499999999999902 | N26: =LOG(M26)-FLOOR(LOG(M26),1) -> 0.79588001734407454 | O26: 7.2499999999999902 | P26: =LOG(O26)-FLOOR(LOG(O26),1) -> 0.86033800657099313 | Q26: 8.2499999999999893 | R26: =LOG(Q26)-FLOOR(LOG(Q26),1) -> 0.91645394854992457 | S26: 9.2499999999999893 | T26: =LOG(S26)-FLOOR(LOG(S26),1) -> 0.96614173273903214
A27: =A26+0.001 -> 1.0259999999999971 | B27: =LOG(A27) -> 1.1147360775796257E-2 | C27: 1.26 | D27: =LOG(C27)-FLOOR(LOG(C27),1) -> 0.10037054511756291 | E27: 2.25999999999999 | F27: =LOG(E27)-FLOOR(LOG(E27),1) -> 0.35410843914739898 | G27: 3.25999999999999 | H27: =LOG(G27)-FLOOR(LOG(G27),1) -> 0.51321760006793771 | I27: 4.25999999999999 | J27: =LOG(I27)-FLOOR(LOG(I27),1) -> 0.62940959910271788 | K27: 5.25999999999999 | L27: =LOG(K27)-FLOOR(LOG(K27),1) -> 0.72098574415373828 | M27: 6.25999999999999 | N27: =LOG(M27)-FLOOR(LOG(M27),1) -> 0.79657433321042903 | O27: 7.25999999999999 | P27: =LOG(O27)-FLOOR(LOG(O27),1) -> 0.86093662070009314 | Q27: 8.2599999999999891 | R27: =LOG(Q27)-FLOOR(LOG(Q27),1) -> 0.91698004732038163 | S27: 9.2599999999999891 | T27: =LOG(S27)-FLOOR(LOG(S27),1) -> 0.96661098668193379
A28: =A27+0.001 -> 1.026999999999997 | B28: =LOG(A28) -> 1.1570443597276939E-2 | C28: 1.27 | D28: =LOG(C28)-FLOOR(LOG(C28),1) -> 0.10380372095595687 | E28: 2.2699999999999898 | F28: =LOG(E28)-FLOOR(LOG(E28),1) -> 0.35602585719312074 | G28: 3.2699999999999898 | H28: =LOG(G28)-FLOOR(LOG(G28),1) -> 0.51454775266028474 | I28: 4.2699999999999898 | J28: =LOG(I28)-FLOOR(LOG(I28),1) -> 0.63042787502502284 | K28: 5.2699999999999898 | L28: =LOG(K28)-FLOOR(LOG(K28),1) -> 0.72181061521254575 | M28: 6.2699999999999898 | N28: =LOG(M28)-FLOOR(LOG(M28),1) -> 0.79726754083071572 | O28: 7.2699999999999898 | P28: =LOG(O28)-FLOOR(LOG(O28),1) -> 0.86153441085903726 | Q28: 8.2699999999999907 | R28: =LOG(Q28)-FLOOR(LOG(Q28),1) -> 0.91750550955254617 | S28: 9.2699999999999907 | T28: =LOG(S28)-FLOOR(LOG(S28),1) -> 0.96707973414449666
A29: =A28+0.001 -> 1.0279999999999969 | B29: =LOG(A29) -> 1.1993114659255625E-2 | C29: 1.28 | D29: =LOG(C29)-FLOOR(LOG(C29),1) -> 0.10720996964786837 | E29: 2.27999999999999 | F29: =LOG(E29)-FLOOR(LOG(E29),1) -> 0.35793484700045192 | G29: 3.27999999999999 | H29: =LOG(G29)-FLOOR(LOG(G29),1) -> 0.51587384371167777 | I29: 4.2799999999999896 | J29: =LOG(I29)-FLOOR(LOG(I29),1) -> 0.63144376901317101 | K29: 5.2799999999999896 | L29: =LOG(K29)-FLOOR(LOG(K29),1) -> 0.72263392253381142 | M29: 6.2799999999999896 | N29: =LOG(M29)-FLOOR(LOG(M29),1) -> 0.79795964373719541 | O29: 7.2799999999999896 | P29: =LOG(O29)-FLOOR(LOG(O29),1) -> 0.86213137931303652 | Q29: 8.2799999999999905 | R29: =LOG(Q29)-FLOOR(LOG(Q29),1) -> 0.91803033678487966 | S29: 9.2799999999999905 | T29: =LOG(S29)-FLOOR(LOG(S29),1) -> 0.96754797621886157
A30: =A29+0.001 -> 1.0289999999999968 | B30: =LOG(A30) -> 1.2415374762431581E-2 | C30: 1.29 | D30: =LOG(C30)-FLOOR(LOG(C30),1) -> 0.11058971029924898 | E30: 2.2899999999999898 | F30: =LOG(E30)-FLOOR(LOG(E30),1) -> 0.35983548233988605 | G30: 3.2899999999999898 | H30: =LOG(G30)-FLOOR(LOG(G30),1) -> 0.517195897949973 | I30: 4.2899999999999903 | J30: =LOG(I30)-FLOOR(LOG(I30),1) -> 0.63245729218472324 | K30: 5.2899999999999903 | L30: =LOG(K30)-FLOOR(LOG(K30),1) -> 0.7234556720351849 | M30: 6.2899999999999903 | N30: =LOG(M30)-FLOOR(LOG(M30),1) -> 0.7986506454452682 | O30: 7.2899999999999903 | P30: =LOG(O30)-FLOOR(LOG(O30),1) -> 0.86272752831797406 | Q30: 8.2899999999999903 | R30: =LOG(Q30)-FLOOR(LOG(Q30),1) -> 0.91855453055027303 | S30: 9.2899999999999903 | T30: =LOG(S30)-FLOOR(LOG(S30),1) -> 0.96801571399364128
A31: =A30+0.001 -> 1.030 | B31: =LOG(A31) -> 1.2837224705170812E-2 | C31: 1.30 | D31: =LOG(C31)-FLOOR(LOG(C31),1) -> 0.11394335230683679 | E31: 2.2999999999999901 | F31: =LOG(E31)-FLOOR(LOG(E31),1) -> 0.36172783601759101 | G31: 3.2999999999999901 | H31: =LOG(G31)-FLOOR(LOG(G31),1) -> 0.51851393987788619 | I31: 4.2999999999999901 | J31: =LOG(I31)-FLOOR(LOG(I31),1) -> 0.63346845557958553 | K31: 5.2999999999999901 | L31: =LOG(K31)-FLOOR(LOG(K31),1) -> 0.72427586960078827 | M31: 6.2999999999999901 | N31: =LOG(M31)-FLOOR(LOG(M31),1) -> 0.79934054945358102 | O31: 7.2999999999999901 | P31: =LOG(O31)-FLOOR(LOG(O31),1) -> 0.86332286012045534 | Q31: 8.2999999999999901 | R31: =LOG(Q31)-FLOOR(LOG(Q31),1) -> 0.91907809237607341 | S31: 9.2999999999999901 | T31: =LOG(S31)-FLOOR(LOG(S31),1) -> 0.96848294855393469
A32: =A31+0.001 -> 1.0309999999999966 | B32: =LOG(A32) -> 1.3258665283515108E-2 | C32: 1.31 | D32: =LOG(C32)-FLOOR(LOG(C32),1) -> 0.11727129565576427 | E32: 2.3099999999999898 | F32: =LOG(E32)-FLOOR(LOG(E32),1) -> 0.36361197989214239 | G32: 3.3099999999999898 | H32: =LOG(G32)-FLOOR(LOG(G32),1) -> 0.51982799377571742 | I32: 4.3099999999999898 | J32: =LOG(I32)-FLOOR(LOG(I32),1) -> 0.63447727016073052 | K32: 5.3099999999999898 | L32: =LOG(K32)-FLOOR(LOG(K32),1) -> 0.72509452108146821 | M32: 6.3099999999999898 | N32: =LOG(M32)-FLOOR(LOG(M32),1) -> 0.80002935924413365 | O32: 7.3099999999999898 | P32: =LOG(O32)-FLOOR(LOG(O32),1) -> 0.86391737695785986 | Q32: 8.3099999999999898 | R32: =LOG(Q32)-FLOOR(LOG(Q32),1) -> 0.91960102378411046 | S32: 9.3099999999999898 | T32: =LOG(S32)-FLOOR(LOG(S32),1) -> 0.96894968098134215
A33: =A32+0.001 -> 1.0319999999999965 | B33: =LOG(A33) -> 1.3679697291191065E-2 | C33: 1.32 | D33: =LOG(C33)-FLOOR(LOG(C33),1) -> 0.12057393120584989 | E33: 2.3199999999999901 | F33: =LOG(E33)-FLOOR(LOG(E33),1) -> 0.36548798489089779 | G33: 3.3199999999999901 | H33: =LOG(G33)-FLOOR(LOG(G33),1) -> 0.52113808370403503 | I33: 4.3199999999999896 | J33: =LOG(I33)-FLOOR(LOG(I33),1) -> 0.63548374681491104 | K33: 5.3199999999999896 | L33: =LOG(K33)-FLOOR(LOG(K33),1) -> 0.72591163229504729 | M33: 6.3199999999999896 | N33: =LOG(M33)-FLOOR(LOG(M33),1) -> 0.80071707828238425 | O33: 7.3199999999999896 | P33: =LOG(O33)-FLOOR(LOG(O33),1) -> 0.86451108105839125 | Q33: 8.3199999999999896 | R33: =LOG(Q33)-FLOOR(LOG(Q33),1) -> 0.92012332629072335 | S33: 9.3199999999999896 | T33: =LOG(S33)-FLOOR(LOG(S33),1) -> 0.96941591235398084
A34: =A33+0.001 -> 1.0329999999999964 | B34: =LOG(A34) -> 1.4100321519619052E-2 | C34: 1.33 | D34: =LOG(C34)-FLOOR(LOG(C34),1) -> 0.12385164096708581 | E34: 2.3299999999999899 | F34: =LOG(E34)-FLOOR(LOG(E34),1) -> 0.36735592102601711 | G34: 3.3299999999999899 | H34: =LOG(G34)-FLOOR(LOG(G34),1) -> 0.52244423350631852 | I34: 4.3299999999999903 | J34: =LOG(I34)-FLOOR(LOG(I34),1) -> 0.63648789635336445 | K34: 5.3299999999999903 | L34: =LOG(K34)-FLOOR(LOG(K34),1) -> 0.72672720902657151 | M34: 6.3299999999999903 | N34: =LOG(M34)-FLOOR(LOG(M34),1) -> 0.80140371001735444 | O34: 7.3299999999999903 | P34: =LOG(O34)-FLOOR(LOG(O34),1) -> 0.86510397464112732 | Q34: 8.3299999999999894 | R34: =LOG(Q34)-FLOOR(LOG(Q34),1) -> 0.92064500140678707 | S34: 9.3299999999999894 | T34: =LOG(S34)-FLOOR(LOG(S34),1) -> 0.96988164374649943
A35: =A34+0.001 -> 1.0339999999999963 | B35: =LOG(A35) -> 1.4520538757922127E-2 | C35: 1.34 | D35: =LOG(C35)-FLOOR(LOG(C35),1) -> 0.12710479836480765 | E35: 2.3399999999999901 | F35: =LOG(E35)-FLOOR(LOG(E35),1) -> 0.36921585741014101 | G35: 3.3399999999999901 | H35: =LOG(G35)-FLOOR(LOG(G35),1) -> 0.52374646681156323 | I35: 4.3399999999999901 | J35: =LOG(I35)-FLOOR(LOG(I35),1) -> 0.63748972951250971 | K35: 5.3399999999999901 | L35: =LOG(K35)-FLOOR(LOG(K35),1) -> 0.72754125702855565 | M35: 6.3399999999999901 | N35: =LOG(M35)-FLOOR(LOG(M35),1) -> 0.80208925788173202 | O35: 7.3399999999999901 | P35: =LOG(O35)-FLOOR(LOG(O35),1) -> 0.8656960599160699 | Q35: 8.3399999999999892 | R35: =LOG(Q35)-FLOOR(LOG(Q35),1) -> 0.92116605063773815 | S35: 9.3399999999999892 | T35: =LOG(S35)-FLOOR(LOG(S35),1) -> 0.97034687623009286
A36: =A35+0.001 -> 1.0349999999999999 | B36: =LOG(A36) -> 1.494034979293494E-2 | C36: 1.35 | D36: =LOG(C36)-FLOOR(LOG(C36),1) -> 0.13033376849500614 | E36: 2.3499999999999899 | F36: =LOG(E36)-FLOOR(LOG(E36),1) -> 0.37106786227173438 | G36: 3.3499999999999899 | H36: =LOG(G36)-FLOOR(LOG(G36),1) -> 0.52504480703684397 | I36: 4.3499999999999899 | J36: =LOG(I36)-FLOOR(LOG(I36),1) -> 0.63848925695463632 | K36: 5.3499999999999899 | L36: =LOG(K36)-FLOOR(LOG(K36),1) -> 0.72835378202122758 | M36: 6.3499999999999899 | N36: =LOG(M36)-FLOOR(LOG(M36),1) -> 0.80277372529197499 | O36: 7.3499999999999899 | P36: =LOG(O36)-FLOOR(LOG(O36),1) -> 0.86628733908419431 | Q36: 8.3499999999999908 | R36: =LOG(Q36)-FLOOR(LOG(Q36),1) -> 0.92168647548360161 | S36: 9.3499999999999908 | T36: =LOG(S36)-FLOOR(LOG(S36),1) -> 0.97081161087251733
A37: =A36+0.001 -> 1.035999999999996 | B37: =LOG(A37) -> 1.5359755409212555E-2 | C37: 1.36 | D37: =LOG(C37)-FLOOR(LOG(C37),1) -> 0.13353890837021754 | E37: 2.3599999999999901 | F37: =LOG(E37)-FLOOR(LOG(E37),1) -> 0.37291200297010474 | G37: 3.3599999999999901 | H37: =LOG(G37)-FLOOR(LOG(G37),1) -> 0.52633927738984276 | I37: 4.3599999999999897 | J37: =LOG(I37)-FLOOR(LOG(I37),1) -> 0.63948648926858498 | K37: 5.3599999999999897 | L37: =LOG(K37)-FLOOR(LOG(K37),1) -> 0.72916478969276921 | M37: 6.3599999999999897 | N37: =LOG(M37)-FLOOR(LOG(M37),1) -> 0.80345711564841316 | O37: 7.3599999999999897 | P37: =LOG(O37)-FLOOR(LOG(O37),1) -> 0.86687781433749822 | Q37: 8.3599999999999905 | R37: =LOG(Q37)-FLOOR(LOG(Q37),1) -> 0.92220627743901595 | S37: 9.3599999999999905 | T37: =LOG(S37)-FLOOR(LOG(S37),1) -> 0.9712758487381048
A38: =A37+0.001 -> 1.0369999999999959 | B38: =LOG(A38) -> 1.5778756389039257E-2 | C38: 1.37 | D38: =LOG(C38)-FLOOR(LOG(C38),1) -> 0.13672056715640679 | E38: 2.3699999999999899 | F38: =LOG(E38)-FLOOR(LOG(E38),1) -> 0.37474834601010204 | G38: 3.3699999999999899 | H38: =LOG(G38)-FLOOR(LOG(G38),1) -> 0.52762990087133732 | I38: 4.3699999999999903 | J38: =LOG(I38)-FLOOR(LOG(I38),1) -> 0.64048143697042093 | K38: 5.3699999999999903 | L38: =LOG(K38)-FLOOR(LOG(K38),1) -> 0.7299742856995548 | M38: 6.3699999999999903 | N38: =LOG(M38)-FLOOR(LOG(M38),1) -> 0.80413943233534979 | O38: 7.3699999999999903 | P38: =LOG(O38)-FLOOR(LOG(O38),1) -> 0.86746748785905092 | Q38: 8.3699999999999903 | R38: =LOG(Q38)-FLOOR(LOG(Q38),1) -> 0.92272545799325945 | S38: 9.3699999999999903 | T38: =LOG(S38)-FLOOR(LOG(S38),1) -> 0.97173959088777784
A39: =A38+0.001 -> 1.0379999999999958 | B39: =LOG(A39) -> 1.6197353512437295E-2 | C39: 1.38 | D39: =LOG(C39)-FLOOR(LOG(C39),1) -> 0.13987908640123647 | E39: 2.3799999999999901 | F39: =LOG(E39)-FLOOR(LOG(E39),1) -> 0.37657695705651018 | G39: 3.3799999999999901 | H39: =LOG(G39)-FLOOR(LOG(G39),1) -> 0.52891670027765347 | I39: 4.3799999999999901 | J39: =LOG(I39)-FLOOR(LOG(I39),1) -> 0.64147411050409853 | K39: 5.3799999999999901 | L39: =LOG(K39)-FLOOR(LOG(K39),1) -> 0.73078227566638843 | M39: 6.3799999999999901 | N39: =LOG(M39)-FLOOR(LOG(M39),1) -> 0.8048206787211617 | O39: 7.3799999999999901 | P39: =LOG(O39)-FLOOR(LOG(O39),1) -> 0.86805636182304102 | Q39: 8.3799999999999901 | R39: =LOG(Q39)-FLOOR(LOG(Q39),1) -> 0.92324401863027594 | S39: 9.3799999999999901 | T39: =LOG(S39)-FLOOR(LOG(S39),1) -> 0.97220283837906396
A40: =A39+0.001 -> 1.0389999999999957 | B40: =LOG(A40) -> 1.6615547557175616E-2 | C40: 1.39 | D40: =LOG(C40)-FLOOR(LOG(C40),1) -> 0.14301480025409505 | E40: 2.3899999999999899 | F40: =LOG(E40)-FLOOR(LOG(E40),1) -> 0.37839790094813586 | G40: 3.3899999999999899 | H40: =LOG(G40)-FLOOR(LOG(G40),1) -> 0.53019969820308088 | I40: 4.3899999999999899 | J40: =LOG(I40)-FLOOR(LOG(I40),1) -> 0.64246452024212042 | K40: 5.3899999999999899 | L40: =LOG(K40)-FLOOR(LOG(K40),1) -> 0.73158876518673788 | M40: 6.3899999999999899 | N40: =LOG(M40)-FLOOR(LOG(M40),1) -> 0.80550085815839945 | O40: 7.3899999999999899 | P40: =LOG(O40)-FLOOR(LOG(O40),1) -> 0.86864443839482519 | Q40: 8.3899999999999899 | R40: =LOG(Q40)-FLOOR(LOG(Q40),1) -> 0.92376196082869977 | S40: 9.3899999999999899 | T40: =LOG(S40)-FLOOR(LOG(S40),1) -> 0.97266559226611049
A41: =A40+0.001 -> 1.040 | B41: =LOG(A41) -> 1.7033339298778514E-2 | C41: 1.40 | D41: =LOG(C41)-FLOOR(LOG(C41),1) -> 0.14612803567823801 | E41: 2.3999999999999901 | F41: =LOG(E41)-FLOOR(LOG(E41),1) -> 0.38021124171160425 | G41: 3.3999999999999901 | H41: =LOG(G41)-FLOOR(LOG(G41),1) -> 0.53147891704225392 | I41: 4.3999999999999897 | J41: =LOG(I41)-FLOOR(LOG(I41),1) -> 0.64345267648618643 | K41: 5.3999999999999897 | L41: =LOG(K41)-FLOOR(LOG(K41),1) -> 0.73239375982296773 | M41: 6.3999999999999897 | N41: =LOG(M41)-FLOOR(LOG(M41),1) -> 0.80617997398388652 | O41: 7.3999999999999897 | P41: =LOG(O41)-FLOOR(LOG(O41),1) -> 0.86923171973097557 | Q41: 8.3999999999999897 | R41: =LOG(Q41)-FLOOR(LOG(Q41),1) -> 0.92427928606188114 | S41: 9.3999999999999897 | T41: =LOG(S41)-FLOOR(LOG(S41),1) -> 0.97312785359969822
A42: =A41+0.001 -> 1.0409999999999955 | B42: =LOG(A42) -> 1.7450729510534273E-2 | C42: 1.41 | D42: =LOG(C42)-FLOOR(LOG(C42),1) -> 0.14921911265537988 | E42: 2.4099999999999899 | F42: =LOG(E42)-FLOOR(LOG(E42),1) -> 0.38201704257486657 | G42: 3.4099999999999899 | H42: =LOG(G42)-FLOOR(LOG(G42),1) -> 0.53275437899249645 | I42: 4.4099999999999904 | J42: =LOG(I42)-FLOOR(LOG(I42),1) -> 0.64443858946783761 | K42: 5.4099999999999904 | L42: =LOG(K42)-FLOOR(LOG(K42),1) -> 0.73319726510656869 | M42: 6.4099999999999904 | N42: =LOG(M42)-FLOOR(LOG(M42),1) -> 0.8068580295188168 | O42: 7.4099999999999904 | P42: =LOG(O42)-FLOOR(LOG(O42),1) -> 0.86981820797932763 | Q42: 8.4099999999999895 | R42: =LOG(Q42)-FLOOR(LOG(Q42),1) -> 0.92479599579791161 | S42: 9.4099999999999895 | T42: =LOG(S42)-FLOOR(LOG(S42),1) -> 0.97358962342725641
A43: =A42+0.001 -> 1.0419999999999954 | B43: =LOG(A43) -> 1.7867718963503743E-2 | C43: 1.42 | D43: =LOG(C43)-FLOOR(LOG(C43),1) -> 0.15228834438305647 | E43: 2.4199999999999902 | F43: =LOG(E43)-FLOOR(LOG(E43),1) -> 0.38381536598042953 | G43: 3.4199999999999902 | H43: =LOG(G43)-FLOOR(LOG(G43),1) -> 0.53402610605613376 | I43: 4.4199999999999902 | J43: =LOG(I43)-FLOOR(LOG(I43),1) -> 0.64542226934909097 | K43: 5.4199999999999902 | L43: =LOG(K43)-FLOOR(LOG(K43),1) -> 0.73399928653838609 | M43: 6.4199999999999902 | N43: =LOG(M43)-FLOOR(LOG(M43),1) -> 0.80753502806885258 | O43: 7.4199999999999902 | P43: =LOG(O43)-FLOOR(LOG(O43),1) -> 0.87040390527902645 | Q43: 8.4199999999999893 | R43: =LOG(Q43)-FLOOR(LOG(Q43),1) -> 0.92531209149964899 | S43: 9.4199999999999893 | T43: =LOG(S43)-FLOOR(LOG(S43),1) -> 0.97405090279287687
A44: =A43+0.001 -> 1.0429999999999953 | B44: =LOG(A44) -> 1.8284308426528898E-2 | C44: 1.43 | D44: =LOG(C44)-FLOOR(LOG(C44),1) -> 0.1553360374650618 | E44: 2.4299999999999899 | F44: =LOG(E44)-FLOOR(LOG(E44),1) -> 0.3856062735983104 | G44: 3.4299999999999899 | H44: =LOG(G44)-FLOOR(LOG(G44),1) -> 0.53529412004276922 | I44: 4.4299999999999899 | J44: =LOG(I44)-FLOOR(LOG(I44),1) -> 0.64640372622306852 | K44: 5.4299999999999899 | L44: =LOG(K44)-FLOOR(LOG(K44),1) -> 0.73479982958884615 | M44: 6.4299999999999899 | N44: =LOG(M44)-FLOOR(LOG(M44),1) -> 0.80821097292422139 | O44: 7.4299999999999899 | P44: =LOG(O44)-FLOOR(LOG(O44),1) -> 0.87098881376057469 | Q44: 8.4299999999999908 | R44: =LOG(Q44)-FLOOR(LOG(Q44),1) -> 0.92582757462474186 | S44: 9.4299999999999908 | T44: =LOG(S44)-FLOOR(LOG(S44),1) -> 0.97451169273732796
A45: =A44+0.001 -> 1.0439999999999952 | B45: =LOG(A45) -> 1.8700498666241336E-2 | C45: 1.44 | D45: =LOG(C45)-FLOOR(LOG(C45),1) -> 0.15836249209524964 | E45: 2.4399999999999902 | F45: =LOG(E45)-FLOOR(LOG(E45),1) -> 0.38738982633872765 | G45: 3.4399999999999902 | H45: =LOG(G45)-FLOOR(LOG(G45),1) -> 0.53655844257152885 | I45: 4.4399999999999897 | J45: =LOG(I45)-FLOOR(LOG(I45),1) -> 0.64738297011461887 | K45: 5.4399999999999897 | L45: =LOG(K45)-FLOOR(LOG(K45),1) -> 0.73559889969817904 | M45: 6.4399999999999897 | N45: =LOG(M45)-FLOOR(LOG(M45),1) -> 0.80888586735981138 | O45: 7.4399999999999897 | P45: =LOG(O45)-FLOOR(LOG(O45),1) -> 0.87157293554587811 | Q45: 8.4399999999999906 | R45: =LOG(Q45)-FLOOR(LOG(Q45),1) -> 0.92634244662565457 | S45: 9.4399999999999906 | T45: =LOG(S45)-FLOOR(LOG(S45),1) -> 0.97497199429806858
A46: =A45+0.001 -> 1.0449999999999999 | B46: =LOG(A46) -> 1.9116290447070746E-2 | C46: 1.45 | D46: =LOG(C46)-FLOOR(LOG(C46),1) -> 0.16136800223497488 | E46: 2.44999999999999 | F46: =LOG(E46)-FLOOR(LOG(E46),1) -> 0.38916608436453071 | G46: 3.44999999999999 | H46: =LOG(G46)-FLOOR(LOG(G46),1) -> 0.53781909507327286 | I46: 4.4499999999999904 | J46: =LOG(I46)-FLOOR(LOG(I46),1) -> 0.64836001098093066 | K46: 5.4499999999999904 | L46: =LOG(K46)-FLOOR(LOG(K46),1) -> 0.73639650227664166 | M46: 6.4499999999999904 | N46: =LOG(M46)-FLOOR(LOG(M46),1) -> 0.8095597146352671 | O46: 7.4499999999999904 | P46: =LOG(O46)-FLOOR(LOG(O46),1) -> 0.87215627274829233 | Q46: 8.4499999999999904 | R46: =LOG(Q46)-FLOOR(LOG(Q46),1) -> 0.92685670894969185 | S46: 9.4499999999999904 | T46: =LOG(S46)-FLOOR(LOG(S46),1) -> 0.97543180850926248
A47: =A46+0.001 -> 1.0459999999999949 | B47: =LOG(A47) -> 1.953168453125333E-2 | C47: 1.46 | D47: =LOG(C47)-FLOOR(LOG(C47),1) -> 0.16435285578443709 | E47: 2.4599999999999902 | F47: =LOG(E47)-FLOOR(LOG(E47),1) -> 0.39093510710337742 | G47: 3.4599999999999902 | H47: =LOG(G47)-FLOOR(LOG(G47),1) -> 0.5390760987927754 | I47: 4.4599999999999902 | J47: =LOG(I47)-FLOOR(LOG(I47),1) -> 0.64933485871214092 | K47: 5.4599999999999902 | L47: =LOG(K47)-FLOOR(LOG(K47),1) -> 0.7371926427047365 | M47: 6.4599999999999902 | N47: =LOG(M47)-FLOOR(LOG(M47),1) -> 0.81023251799508345 | O47: 7.4599999999999902 | P47: =LOG(O47)-FLOOR(LOG(O47),1) -> 0.87273882747266818 | Q47: 8.4599999999999902 | R47: =LOG(Q47)-FLOOR(LOG(Q47),1) -> 0.92737036303902298 | S47: 9.4599999999999902 | T47: =LOG(S47)-FLOOR(LOG(S47),1) -> 0.97589113640179226
A48: =A47+0.001 -> 1.0469999999999948 | B48: =LOG(A48) -> 1.9946681678840186E-2 | C48: 1.47 | D48: =LOG(C48)-FLOOR(LOG(C48),1) -> 0.16731733474817609 | E48: 2.46999999999999 | F48: =LOG(E48)-FLOOR(LOG(E48),1) -> 0.39269695325966397 | G48: 3.46999999999999 | H48: =LOG(G48)-FLOOR(LOG(G48),1) -> 0.54032947479087245 | I48: 4.46999999999999 | J48: =LOG(I48)-FLOOR(LOG(I48),1) -> 0.65030752313193552 | K48: 5.46999999999999 | L48: =LOG(K48)-FLOOR(LOG(K48),1) -> 0.73798732633343 | M48: 6.46999999999999 | N48: =LOG(M48)-FLOOR(LOG(M48),1) -> 0.81090428066869968 | O48: 7.46999999999999 | P48: =LOG(O48)-FLOOR(LOG(O48),1) -> 0.87332060181539817 | Q48: 8.46999999999999 | R48: =LOG(Q48)-FLOOR(LOG(Q48),1) -> 0.92788341033070643 | S48: 9.46999999999999 | T48: =LOG(S48)-FLOOR(LOG(S48),1) -> 0.97634997900327292
A49: =A48+0.001 -> 1.0479999999999947 | B49: =LOG(A49) -> 2.0361282647705654E-2 | C49: 1.48 | D49: =LOG(C49)-FLOOR(LOG(C49),1) -> 0.17026171539495738 | E49: 2.4799999999999902 | F49: =LOG(E49)-FLOOR(LOG(E49),1) -> 0.39445168082621457 | G49: 3.4799999999999902 | H49: =LOG(G49)-FLOOR(LOG(G49),1) -> 0.54157924394657975 | I49: 4.4799999999999898 | J49: =LOG(I49)-FLOOR(LOG(I49),1) -> 0.651278013998143 | K49: 5.4799999999999898 | L49: =LOG(K49)-FLOOR(LOG(K49),1) -> 0.7387805584843683 | M49: 6.4799999999999898 | N49: =LOG(M49)-FLOOR(LOG(M49),1) -> 0.81157500587059261 | O49: 7.4799999999999898 | P49: =LOG(O49)-FLOOR(LOG(O49),1) -> 0.87390159786446076 | Q49: 8.4799999999999898 | R49: =LOG(Q49)-FLOOR(LOG(Q49),1) -> 0.92839585225671328 | S49: 9.4799999999999898 | T49: =LOG(S49)-FLOOR(LOG(S49),1) -> 0.97680833733806582
A50: =A49+0.001 -> 1.0489999999999946 | B50: =LOG(A50) -> 2.0775488193555625E-2 | C50: 1.49 | D50: =LOG(C50)-FLOOR(LOG(C50),1) -> 0.17318626841227402 | E50: 2.48999999999999 | F50: =LOG(E50)-FLOOR(LOG(E50),1) -> 0.39619934709573462 | G50: 3.48999999999999 | H50: =LOG(G50)-FLOOR(LOG(G50),1) -> 0.54282542695917868 | I50: 4.4899999999999904 | J50: =LOG(I50)-FLOOR(LOG(I50),1) -> 0.65224634100332224 | K50: 5.4899999999999904 | L50: =LOG(K50)-FLOOR(LOG(K50),1) -> 0.73957234445009112 | M50: 6.4899999999999904 | N50: =LOG(M50)-FLOOR(LOG(M50),1) -> 0.81224469680036859 | O50: 7.4899999999999904 | P50: =LOG(O50)-FLOOR(LOG(O50),1) -> 0.87448181769946587 | Q50: 8.4899999999999896 | R50: =LOG(Q50)-FLOOR(LOG(Q50),1) -> 0.92890769024395214 | S50: 9.4899999999999896 | T50: =LOG(S50)-FLOOR(LOG(S50),1) -> 0.97726621242729217
A51: =A50+0.001 -> 1.0499999999999945 | B51: =LOG(A51) -> 2.1189299069935795E-2 | C51: 1.50 | D51: =LOG(C51)-FLOOR(LOG(C51),1) -> 0.17609125905568124 | E51: 2.4999999999999898 | F51: =LOG(E51)-FLOOR(LOG(E51),1) -> 0.39794000867203583 | G51: 3.4999999999999898 | H51: =LOG(G51)-FLOOR(LOG(G51),1) -> 0.54406804435027434 | I51: 4.4999999999999902 | J51: =LOG(I51)-FLOOR(LOG(I51),1) -> 0.65321251377534273 | K51: 5.4999999999999902 | L51: =LOG(K51)-FLOOR(LOG(K51),1) -> 0.74036268949424311 | M51: 6.4999999999999902 | N51: =LOG(M51)-FLOOR(LOG(M51),1) -> 0.81291335664285491 | O51: 7.4999999999999902 | P51: =LOG(O51)-FLOOR(LOG(O51),1) -> 0.87506126339169943 | Q51: 8.4999999999999893 | R51: =LOG(Q51)-FLOOR(LOG(Q51),1) -> 0.92941892571429219 | S51: 9.4999999999999893 | T51: =LOG(S51)-FLOOR(LOG(S51),1) -> 0.97772360528884728
A52: =A51+0.001 -> 1.0509999999999944 | B52: =LOG(A52) -> 2.1602716028239898E-2 | C52: 1.51 | D52: =LOG(C52)-FLOOR(LOG(C52),1) -> 0.17897694729316943 | E52: 2.50999999999999 | F52: =LOG(E52)-FLOOR(LOG(E52),1) -> 0.39967372148103641 | G52: 3.50999999999999 | H52: =LOG(G52)-FLOOR(LOG(G52),1) -> 0.54530711646582286 | I52: 4.50999999999999 | J52: =LOG(I52)-FLOOR(LOG(I52),1) -> 0.65417654187795959 | K52: 5.50999999999999 | L52: =LOG(K52)-FLOOR(LOG(K52),1) -> 0.74115159885178428 | M52: 6.50999999999999 | N52: =LOG(M52)-FLOOR(LOG(M52),1) -> 0.81358098856819128 | O52: 7.50999999999999 | P52: =LOG(O52)-FLOOR(LOG(O52),1) -> 0.87563993700416787 | Q52: 8.5099999999999891 | R52: =LOG(Q52)-FLOOR(LOG(Q52),1) -> 0.92992956008458727 | S52: 9.5099999999999891 | T52: =LOG(S52)-FLOOR(LOG(S52),1) -> 0.97818051693741348
A53: =A52+0.001 -> 1.0519999999999943 | B53: =LOG(A53) -> 2.2015739817717896E-2 | C53: 1.52 | D53: =LOG(C53)-FLOOR(LOG(C53),1) -> 0.18184358794477254 | E53: 2.5199999999999898 | F53: =LOG(E53)-FLOOR(LOG(E53),1) -> 0.40140054078154236 | G53: 3.5199999999999898 | H53: =LOG(G53)-FLOOR(LOG(G53),1) -> 0.54654266347812974 | I53: 4.5199999999999898 | J53: =LOG(I53)-FLOOR(LOG(I53),1) -> 0.65513843481138112 | K53: 5.5199999999999898 | L53: =LOG(K53)-FLOOR(LOG(K53),1) -> 0.74193907772919809 | M53: 6.5199999999999898 | N53: =LOG(M53)-FLOOR(LOG(M53),1) -> 0.81424759573191952 | O53: 7.5199999999999898 | P53: =LOG(O53)-FLOOR(LOG(O53),1) -> 0.87621784059164165 | Q53: 8.5199999999999907 | R53: =LOG(Q53)-FLOOR(LOG(Q53),1) -> 0.93043959476669968 | S53: 9.5199999999999907 | T53: =LOG(S53)-FLOOR(LOG(S53),1) -> 0.9786369483844739
A54: =A53+0.001 -> 1.0529999999999942 | B54: =LOG(A54) -> 2.242837118548411E-2 | C54: 1.53 | D54: =LOG(C54)-FLOOR(LOG(C54),1) -> 0.18469143081759881 | E54: 2.52999999999999 | F54: =LOG(E54)-FLOOR(LOG(E54),1) -> 0.4031205211758162 | G54: 3.52999999999999 | H54: =LOG(G54)-FLOOR(LOG(G54),1) -> 0.54777470538782136 | I54: 4.5299999999999896 | J54: =LOG(I54)-FLOOR(LOG(I54),1) -> 0.65609820201283087 | K54: 5.5299999999999896 | L54: =LOG(K54)-FLOOR(LOG(K54),1) -> 0.74272513130469742 | M54: 6.5299999999999896 | N54: =LOG(M54)-FLOOR(LOG(M54),1) -> 0.81491318127507328 | O54: 7.5299999999999896 | P54: =LOG(O54)-FLOOR(LOG(O54),1) -> 0.87679497620070002 | Q54: 8.5299999999999905 | R54: =LOG(Q54)-FLOOR(LOG(Q54),1) -> 0.93094903116752259 | S54: 9.5299999999999905 | T54: =LOG(S54)-FLOOR(LOG(S54),1) -> 0.97909290063832599
A55: =A54+0.001 -> 1.0539999999999941 | B55: =LOG(A55) -> 2.2840610876525353E-2 | C55: 1.54 | D55: =LOG(C55)-FLOOR(LOG(C55),1) -> 0.18752072083646307 | E55: 2.5399999999999898 | F55: =LOG(E55)-FLOOR(LOG(E55),1) -> 0.40483371661993633 | G55: 3.5399999999999898 | H55: =LOG(G55)-FLOOR(LOG(G55),1) -> 0.54900326202578653 | I55: 4.5399999999999903 | J55: =LOG(I55)-FLOOR(LOG(I55),1) -> 0.657055852857103 | K55: 5.5399999999999903 | L55: =LOG(K55)-FLOOR(LOG(K55),1) -> 0.743509764728429 | M55: 6.5399999999999903 | N55: =LOG(M55)-FLOOR(LOG(M55),1) -> 0.81557774832426666 | O55: 7.5399999999999903 | P55: =LOG(O55)-FLOOR(LOG(O55),1) -> 0.8773713458697735 | Q55: 8.5399999999999903 | R55: =LOG(Q55)-FLOOR(LOG(Q55),1) -> 0.93145787068900454 | S55: 9.5399999999999903 | T55: =LOG(S55)-FLOOR(LOG(S55),1) -> 0.97954837470409473
A56: =A55+0.001 -> 1.0549999999999939 | B56: =LOG(A56) -> 2.3252459633708977E-2 | C56: 1.55 | D56: =LOG(C56)-FLOOR(LOG(C56),1) -> 0.1903316981702915 | E56: 2.5499999999999901 | F56: =LOG(E56)-FLOOR(LOG(E56),1) -> 0.40654018043395346 | G56: 3.5499999999999901 | H56: =LOG(G56)-FLOOR(LOG(G56),1) -> 0.55022835305509288 | I56: 4.5499999999999901 | J56: =LOG(I56)-FLOOR(LOG(I56),1) -> 0.6580113966571115 | K56: 5.5499999999999901 | L56: =LOG(K56)-FLOOR(LOG(K56),1) -> 0.74429298312267544 | M56: 6.5499999999999901 | N56: =LOG(M56)-FLOOR(LOG(M56),1) -> 0.81624129999178241 | O56: 7.5499999999999901 | P56: =LOG(O56)-FLOOR(LOG(O56),1) -> 0.87794695162918768 | Q56: 8.5499999999999901 | R56: =LOG(Q56)-FLOOR(LOG(Q56),1) -> 0.93196611472817215 | S56: 9.5499999999999901 | T56: =LOG(S56)-FLOOR(LOG(S56),1) -> 0.98000337158374584
A57: =A56+0.001 -> 1.0559999999999938 | B57: =LOG(A57) -> 2.3663918197790918E-2 | C57: 1.56 | D57: =LOG(C57)-FLOOR(LOG(C57),1) -> 0.19312459835446161 | E57: 2.5599999999999898 | F57: =LOG(E57)-FLOOR(LOG(E57),1) -> 0.40823996531184786 | G57: 3.5599999999999898 | H57: =LOG(G57)-FLOOR(LOG(G57),1) -> 0.55144999797287397 | I57: 4.5599999999999898 | J57: =LOG(I57)-FLOOR(LOG(I57),1) -> 0.658964842664434 | K57: 5.5599999999999898 | L57: =LOG(K57)-FLOOR(LOG(K57),1) -> 0.74507479158205669 | M57: 6.5599999999999898 | N57: =LOG(M57)-FLOOR(LOG(M57),1) -> 0.81690383937565958 | O57: 7.5599999999999898 | P57: =LOG(O57)-FLOOR(LOG(O57),1) -> 0.8785217955012059 | Q57: 8.5599999999999898 | R57: =LOG(Q57)-FLOOR(LOG(Q57),1) -> 0.93247376467715271 | S57: 9.5599999999999898 | T57: =LOG(S57)-FLOOR(LOG(S57),1) -> 0.98045789227609959
A58: =A57+0.001 -> 1.0569999999999937 | B58: =LOG(A58) -> 2.407498730742369E-2 | C58: 1.57 | D58: =LOG(C58)-FLOOR(LOG(C58),1) -> 0.19589965240923377 | E58: 2.5699999999999901 | F58: =LOG(E58)-FLOOR(LOG(E58),1) -> 0.40993312333129284 | G58: 3.5699999999999901 | H58: =LOG(G58)-FLOOR(LOG(G58),1) -> 0.55266821611219197 | I58: 4.5699999999999896 | J58: =LOG(I58)-FLOOR(LOG(I58),1) -> 0.65991620006984919 | K58: 5.5699999999999896 | L58: =LOG(K58)-FLOOR(LOG(K58),1) -> 0.74585519517372811 | M58: 6.5699999999999896 | N58: =LOG(M58)-FLOOR(LOG(M58),1) -> 0.8175653695597801 | O58: 7.5699999999999896 | P58: =LOG(O58)-FLOOR(LOG(O58),1) -> 0.87909587950007217 | Q58: 8.5699999999999896 | R58: =LOG(Q58)-FLOOR(LOG(Q58),1) -> 0.93298082192319765 | S58: 9.5699999999999896 | T58: =LOG(S58)-FLOOR(LOG(S58),1) -> 0.98091193777684305
A59: =A58+0.001 -> 1.0579999999999936 | B59: =LOG(A59) -> 2.448566769916433E-2 | C59: 1.58 | D59: =LOG(C59)-FLOOR(LOG(C59),1) -> 0.19865708695442263 | E59: 2.5799999999999899 | F59: =LOG(E59)-FLOOR(LOG(E59),1) -> 0.41161970596322844 | G59: 3.5799999999999899 | H59: =LOG(G59)-FLOOR(LOG(G59),1) -> 0.55388302664387312 | I59: 4.5799999999999903 | J59: =LOG(I59)-FLOOR(LOG(I59),1) -> 0.6608654780038683 | K59: 5.5799999999999903 | L59: =LOG(K59)-FLOOR(LOG(K59),1) -> 0.74663419893757799 | M59: 6.5799999999999903 | N59: =LOG(M59)-FLOOR(LOG(M59),1) -> 0.81822589361395481 | O59: 7.5799999999999903 | P59: =LOG(O59)-FLOOR(LOG(O59),1) -> 0.87966920563205298 | Q59: 8.5799999999999894 | R59: =LOG(Q59)-FLOOR(LOG(Q59),1) -> 0.93348728784870494 | S59: 9.5799999999999894 | T59: =LOG(S59)-FLOOR(LOG(S59),1) -> 0.98136550907854392
A60: =A59+0.001 -> 1.0589999999999935 | B60: =LOG(A60) -> 2.4895960107482337E-2 | C60: 1.59 | D60: =LOG(C60)-FLOOR(LOG(C60),1) -> 0.20139712432045151 | E60: 2.5899999999999901 | F60: =LOG(E60)-FLOOR(LOG(E60),1) -> 0.41329976408125019 | G60: 3.5899999999999901 | H60: =LOG(G60)-FLOOR(LOG(G60),1) -> 0.55509444857831791 | I60: 4.5899999999999901 | J60: =LOG(I60)-FLOOR(LOG(I60),1) -> 0.66181268553726025 | K60: 5.5899999999999901 | L60: =LOG(K60)-FLOOR(LOG(K60),1) -> 0.74741180788642247 | M60: 6.5899999999999901 | N60: =LOG(M60)-FLOOR(LOG(M60),1) -> 0.81888541459400921 | O60: 7.5899999999999901 | P60: =LOG(O60)-FLOOR(LOG(O60),1) -> 0.88024177589547981 | Q60: 8.5899999999999892 | R60: =LOG(Q60)-FLOOR(LOG(Q60),1) -> 0.93399316383124176 | S60: 9.5899999999999892 | T60: =LOG(S60)-FLOOR(LOG(S60),1) -> 0.98181860717066316
A61: =A60+0.001 -> 1.0599999999999934 | B61: =LOG(A61) -> 2.5305865264767535E-2 | C61: 1.60 | D61: =LOG(C61)-FLOOR(LOG(C61),1) -> 0.20411998265592479 | E61: 2.5999999999999899 | F61: =LOG(E61)-FLOOR(LOG(E61),1) -> 0.41497334797081625 | G61: 3.5999999999999899 | H61: =LOG(G61)-FLOOR(LOG(G61),1) -> 0.55630250076728605 | I61: 4.5999999999999899 | J61: =LOG(I61)-FLOOR(LOG(I61),1) -> 0.6627578316815731 | K61: 5.5999999999999899 | L61: =LOG(K61)-FLOOR(LOG(K61),1) -> 0.74818802700619969 | M61: 6.5999999999999899 | N61: =LOG(M61)-FLOOR(LOG(M61),1) -> 0.819543935541868 | O61: 7.5999999999999899 | P61: =LOG(O61)-FLOOR(LOG(O61),1) -> 0.88081359228079081 | Q61: 8.5999999999999908 | R61: =LOG(Q61)-FLOOR(LOG(Q61),1) -> 0.93449845124356723 | S61: 9.5999999999999908 | T61: =LOG(S61)-FLOOR(LOG(S61),1) -> 0.98227123303956798
A62: =A61+0.001 -> 1.0609999999999933 | B62: =LOG(A62) -> 2.5715383901337915E-2 | C62: 1.61 | D62: =LOG(C62)-FLOOR(LOG(C62),1) -> 0.20682587603184974 | E62: 2.6099999999999901 | F62: =LOG(E62)-FLOOR(LOG(E62),1) -> 0.41664050733827934 | G62: 3.6099999999999901 | H62: =LOG(G62)-FLOOR(LOG(G62),1) -> 0.55750720190565672 | I62: 4.6099999999999897 | J62: =LOG(I62)-FLOOR(LOG(I62),1) -> 0.6637009253896472 | K62: 5.6099999999999897 | L62: =LOG(K62)-FLOOR(LOG(K62),1) -> 0.74896286125616063 | M62: 6.6099999999999897 | N62: =LOG(M62)-FLOOR(LOG(M62),1) -> 0.82020145948563961 | O62: 7.6099999999999897 | P62: =LOG(O62)-FLOOR(LOG(O62),1) -> 0.88138465677057221 | Q62: 8.6099999999999905 | R62: =LOG(Q62)-FLOOR(LOG(Q62),1) -> 0.93500315145365431 | S62: 9.6099999999999905 | T62: =LOG(S62)-FLOOR(LOG(S62),1) -> 0.98272338766854495
A63: =A62+0.001 -> 1.0619999999999932 | B63: =LOG(A63) -> 2.6124516745447468E-2 | C63: 1.62 | D63: =LOG(C63)-FLOOR(LOG(C63),1) -> 0.20951501454263097 | E63: 2.6199999999999899 | F63: =LOG(E63)-FLOOR(LOG(E63),1) -> 0.41830129131974381 | G63: 3.6199999999999899 | H63: =LOG(G63)-FLOOR(LOG(G63),1) -> 0.55870857053316447 | I63: 4.6199999999999903 | J63: =LOG(I63)-FLOOR(LOG(I63),1) -> 0.66464197555612459 | K63: 5.6199999999999903 | L63: =LOG(K63)-FLOOR(LOG(K63),1) -> 0.7497363155690604 | M63: 6.6199999999999903 | N63: =LOG(M63)-FLOOR(LOG(M63),1) -> 0.82085798943969934 | O63: 7.6199999999999903 | P63: =LOG(O63)-FLOOR(LOG(O63),1) -> 0.88195497133959999 | Q63: 8.6199999999999903 | R63: =LOG(Q63)-FLOOR(LOG(Q63),1) -> 0.93550726582471233 | S63: 9.6199999999999903 | T63: =LOG(S63)-FLOOR(LOG(S63),1) -> 0.98317507203781251
A64: =A63+0.001 -> 1.0629999999999931 | B64: =LOG(A64) -> 2.6533264523293923E-2 | C64: 1.63 | D64: =LOG(C64)-FLOOR(LOG(C64),1) -> 0.21218760440395779 | E64: 2.6299999999999901 | F64: =LOG(E64)-FLOOR(LOG(E64),1) -> 0.41995574848975625 | G64: 3.6299999999999901 | H64: =LOG(G64)-FLOOR(LOG(G64),1) -> 0.55990662503611133 | I64: 4.6299999999999901 | J64: =LOG(I64)-FLOOR(LOG(I64),1) -> 0.66558099101795221 | K64: 5.6299999999999901 | L64: =LOG(K64)-FLOOR(LOG(K64),1) -> 0.75050839485134546 | M64: 6.6299999999999901 | N64: =LOG(M64)-FLOOR(LOG(M64),1) -> 0.82151352840477254 | O64: 7.6299999999999901 | P64: =LOG(O64)-FLOOR(LOG(O64),1) -> 0.88252453795487995 | Q64: 8.6299999999999901 | R64: =LOG(Q64)-FLOOR(LOG(Q64),1) -> 0.93601079571520907 | S64: 9.6299999999999901 | T64: =LOG(S64)-FLOOR(LOG(S64),1) -> 0.98362628712453404
A65: =A64+0.001 -> 1.063999999999993 | B65: =LOG(A65) -> 2.69416279590265E-2 | C65: 1.64 | D65: =LOG(C65)-FLOOR(LOG(C65),1) -> 0.21484384804769785 | E65: 2.6399999999999899 | F65: =LOG(E65)-FLOOR(LOG(E65),1) -> 0.42160392686982939 | G65: 3.6399999999999899 | H65: =LOG(G65)-FLOOR(LOG(G65),1) -> 0.56110138364905482 | I65: 4.6399999999999899 | J65: =LOG(I65)-FLOOR(LOG(I65),1) -> 0.66651798055487987 | K65: 5.6399999999999899 | L65: =LOG(K65)-FLOOR(LOG(K65),1) -> 0.75127910398334152 | M65: 6.6399999999999899 | N65: =LOG(M65)-FLOOR(LOG(M65),1) -> 0.82216807936801684 | O65: 7.6399999999999899 | P65: =LOG(O65)-FLOOR(LOG(O65),1) -> 0.88309335857568938 | Q65: 8.6399999999999899 | R65: =LOG(Q65)-FLOOR(LOG(Q65),1) -> 0.93651374247889274 | S65: 9.6399999999999899 | T65: =LOG(S65)-FLOOR(LOG(S65),1) -> 0.9840770339028303
A66: =A65+0.001 -> 1.0649999999999928 | B66: =LOG(A66) -> 2.734960777475361E-2 | C66: 1.65 | D66: =LOG(C66)-FLOOR(LOG(C66),1) -> 0.21748394421390627 | E66: 2.6499999999999901 | F66: =LOG(E66)-FLOOR(LOG(E66),1) -> 0.42324587393680624 | G66: 3.6499999999999901 | H66: =LOG(G66)-FLOOR(LOG(G66),1) -> 0.56229286445647353 | I66: 4.6499999999999897 | J66: =LOG(I66)-FLOOR(LOG(I66),1) -> 0.66745295288995299 | K66: 5.6499999999999897 | L66: =LOG(K66)-FLOOR(LOG(K66),1) -> 0.75204844781943769 | M66: 6.6499999999999897 | N66: =LOG(M66)-FLOOR(LOG(M66),1) -> 0.82282164530310398 | O66: 7.6499999999999897 | P66: =LOG(O66)-FLOOR(LOG(O66),1) -> 0.88366143515361706 | Q66: 8.6499999999999897 | R66: =LOG(Q66)-FLOOR(LOG(Q66),1) -> 0.93701610746481367 | S66: 9.6499999999999897 | T66: =LOG(S66)-FLOOR(LOG(S66),1) -> 0.98452731334379207
A67: =A66+0.001 -> 1.0659999999999927 | B67: =LOG(A67) -> 2.7757204690550496E-2 | C67: 1.66 | D67: =LOG(C67)-FLOOR(LOG(C67),1) -> 0.22010808804005508 | E67: 2.6599999999999899 | F67: =LOG(E67)-FLOOR(LOG(E67),1) -> 0.42488163663106532 | G67: 3.6599999999999899 | H67: =LOG(G67)-FLOOR(LOG(G67),1) -> 0.56348108539440944 | I67: 4.6599999999999904 | J67: =LOG(I67)-FLOOR(LOG(I67),1) -> 0.66838591668999925 | K67: 5.6599999999999904 | L67: =LOG(K67)-FLOOR(LOG(K67),1) -> 0.75281643118827068 | M67: 6.6599999999999904 | N67: =LOG(M67)-FLOOR(LOG(M67),1) -> 0.82347422917030044 | O67: 7.6599999999999904 | P67: =LOG(O67)-FLOOR(LOG(O67),1) -> 0.88422876963260344 | Q67: 8.6599999999999895 | R67: =LOG(Q67)-FLOOR(LOG(Q67),1) -> 0.93751789201734614 | S67: 9.6599999999999895 | T67: =LOG(S67)-FLOOR(LOG(S67),1) -> 0.98497712641549284
A68: =A67+0.001 -> 1.0669999999999926 | B68: =LOG(A68) -> 2.8164419424466888E-2 | C68: 1.67 | D68: =LOG(C68)-FLOOR(LOG(C68),1) -> 0.22271647114758325 | E68: 2.6699999999999902 | F68: =LOG(E68)-FLOOR(LOG(E68),1) -> 0.42651126136457362 | G68: 3.6699999999999902 | H68: =LOG(G68)-FLOOR(LOG(G68),1) -> 0.56466606425208821 | I68: 4.6699999999999902 | J68: =LOG(I68)-FLOOR(LOG(I68),1) -> 0.66931688056611127 | K68: 5.6699999999999902 | L68: =LOG(K68)-FLOOR(LOG(K68),1) -> 0.75358305889290578 | M68: 6.6699999999999902 | N68: =LOG(M68)-FLOOR(LOG(M68),1) -> 0.82412583391654837 | O68: 7.6699999999999902 | P68: =LOG(O68)-FLOOR(LOG(O68),1) -> 0.8847953639489804 | Q68: 8.6699999999999893 | R68: =LOG(Q68)-FLOOR(LOG(Q68),1) -> 0.93801909747620971 | S68: 9.6699999999999893 | T68: =LOG(S68)-FLOOR(LOG(S68),1) -> 0.98542647408300121
A69: =A68+0.001 -> 1.0679999999999925 | B69: =LOG(A69) -> 2.8571252692534566E-2 | C69: 1.68 | D69: =LOG(C69)-FLOOR(LOG(C69),1) -> 0.22530928172586284 | E69: 2.6799999999999899 | F69: =LOG(E69)-FLOOR(LOG(E69),1) -> 0.42813479402878718 | G69: 3.6799999999999899 | H69: =LOG(G69)-FLOOR(LOG(G69),1) -> 0.56584781867351652 | I69: 4.6799999999999899 | J69: =LOG(I69)-FLOOR(LOG(I69),1) -> 0.6702458530741231 | K69: 5.6799999999999899 | L69: =LOG(K69)-FLOOR(LOG(K69),1) -> 0.75434833571101811 | M69: 6.6799999999999899 | N69: =LOG(M69)-FLOOR(LOG(M69),1) -> 0.82477646247554504 | O69: 7.6799999999999899 | P69: =LOG(O69)-FLOOR(LOG(O69),1) -> 0.88536122003151141 | Q69: 8.6799999999999908 | R69: =LOG(Q69)-FLOOR(LOG(Q69),1) -> 0.9385197251764914 | S69: 9.6799999999999908 | T69: =LOG(S69)-FLOOR(LOG(S69),1) -> 0.98587535730839326
A70: =A69+0.001 -> 1.0689999999999924 | B70: =LOG(A70) -> 2.8977705208774931E-2 | C70: 1.69 | D70: =LOG(C70)-FLOOR(LOG(C70),1) -> 0.22788670461367352 | E70: 2.68999999999998 | F70: =LOG(E70)-FLOOR(LOG(E70),1) -> 0.42975228000240473 | G70: 3.68999999999998 | H70: =LOG(G70)-FLOOR(LOG(G70),1) -> 0.56702636615905799 | I70: 4.6899999999999897 | J70: =LOG(I70)-FLOOR(LOG(I70),1) -> 0.67117284271508226 | K70: 5.6899999999999897 | L70: =LOG(K70)-FLOOR(LOG(K70),1) -> 0.75511226639507034 | M70: 6.6899999999999897 | N70: =LOG(M70)-FLOOR(LOG(M70),1) -> 0.82542611776782249 | O70: 7.6899999999999897 | P70: =LOG(O70)-FLOOR(LOG(O70),1) -> 0.88592633980143043 | Q70: 8.6899999999999906 | R70: =LOG(Q70)-FLOOR(LOG(Q70),1) -> 0.93901977644866597 | S70: 9.6899999999999906 | T70: =LOG(S70)-FLOOR(LOG(S70),1) -> 0.9863237770507649
A71: =A70+0.001 -> 1.0699999999999923 | B71: =LOG(A71) -> 2.9383777685206513E-2 | C71: 1.70 | D71: =LOG(C71)-FLOOR(LOG(C71),1) -> 0.23044892137827391 | E71: 2.69999999999999 | F71: =LOG(E71)-FLOOR(LOG(E71),1) -> 0.4313637641589857 | G71: 3.69999999999999 | H71: =LOG(G71)-FLOOR(LOG(G71),1) -> 0.56820172406699387 | I71: 4.6999999999999904 | J71: =LOG(I71)-FLOOR(LOG(I71),1) -> 0.67209785793571653 | K71: 5.6999999999999904 | L71: =LOG(K71)-FLOOR(LOG(K71),1) -> 0.75587485567249069 | M71: 6.6999999999999904 | N71: =LOG(M71)-FLOOR(LOG(M71),1) -> 0.82607480270082578 | O71: 7.6999999999999904 | P71: =LOG(O71)-FLOOR(LOG(O71),1) -> 0.88649072517248129 | Q71: 8.6999999999999904 | R71: =LOG(Q71)-FLOOR(LOG(Q71),1) -> 0.93951925261861802 | S71: 9.6999999999999904 | T71: =LOG(S71)-FLOOR(LOG(S71),1) -> 0.98677173426624443
A72: =A71+0.001 -> 1.0709999999999922 | B72: =LOG(A72) -> 2.9789470831852464E-2 | C72: 1.71 | D72: =LOG(C72)-FLOOR(LOG(C72),1) -> 0.23299611039215382 | E72: 2.70999999999998 | F72: =LOG(E72)-FLOOR(LOG(E72),1) -> 0.4329692908744025 | G72: 3.70999999999998 | H72: =LOG(G72)-FLOOR(LOG(G72),1) -> 0.56937390961504353 | I72: 4.7099999999999804 | J72: =LOG(I72)-FLOOR(LOG(I72),1) -> 0.6730209071288944 | K72: 5.7099999999999804 | L72: =LOG(K72)-FLOOR(LOG(K72),1) -> 0.75663610824584659 | M72: 6.7099999999999804 | N72: =LOG(M72)-FLOOR(LOG(M72),1) -> 0.82672252016899084 | O72: 7.7099999999999804 | P72: =LOG(O72)-FLOOR(LOG(O72),1) -> 0.88705437805095588 | Q72: 8.7099999999999795 | R72: =LOG(Q72)-FLOOR(LOG(Q72),1) -> 0.94001815500766217 | S72: 9.7099999999999795 | T72: =LOG(S72)-FLOOR(LOG(S72),1) -> 0.98721922990800393
A73: =A72+0.001 -> 1.0719999999999921 | B73: =LOG(A73) -> 3.0194785356748001E-2 | C73: 1.72 | D73: =LOG(C73)-FLOOR(LOG(C73),1) -> 0.2355284469075489 | E73: 2.71999999999999 | F73: =LOG(E73)-FLOOR(LOG(E73),1) -> 0.43456890403419712 | G73: 3.71999999999999 | H73: =LOG(G73)-FLOOR(LOG(G73),1) -> 0.5705429398818963 | I73: 4.7199999999999802 | J73: =LOG(I73)-FLOOR(LOG(I73),1) -> 0.67394199863408599 | K73: 5.7199999999999802 | L73: =LOG(K73)-FLOOR(LOG(K73),1) -> 0.7573960287930227 | M73: 6.7199999999999802 | N73: =LOG(M73)-FLOOR(LOG(M73),1) -> 0.82736927305382402 | O73: 7.7199999999999802 | P73: =LOG(O73)-FLOOR(LOG(O73),1) -> 0.88761730033573505 | Q73: 8.7199999999999793 | R73: =LOG(Q73)-FLOOR(LOG(Q73),1) -> 0.94051648493256623 | S73: 9.7199999999999793 | T73: =LOG(S73)-FLOOR(LOG(S73),1) -> 0.98766626492627363
A74: =A73+0.001 -> 1.072999999999992 | B74: =LOG(A74) -> 3.0599721965947829E-2 | C74: 1.73 | D74: =LOG(C74)-FLOOR(LOG(C74),1) -> 0.2380461031287954 | E74: 2.72999999999998 | F74: =LOG(E74)-FLOOR(LOG(E74),1) -> 0.43616264704075286 | G74: 3.72999999999998 | H74: =LOG(G74)-FLOOR(LOG(G74),1) -> 0.57170883180868526 | I74: 4.72999999999998 | J74: =LOG(I74)-FLOOR(LOG(I74),1) -> 0.67486114073780978 | K74: 5.72999999999998 | L74: =LOG(K74)-FLOOR(LOG(K74),1) -> 0.75815462196738848 | M74: 6.72999999999998 | N74: =LOG(M74)-FLOOR(LOG(M74),1) -> 0.82801506422397553 | O74: 7.72999999999998 | P74: =LOG(O74)-FLOOR(LOG(O74),1) -> 0.88817949391832374 | Q74: 8.7299999999999809 | R74: =LOG(Q74)-FLOOR(LOG(Q74),1) -> 0.94101424370556874 | S74: 9.7299999999999809 | T74: =LOG(S74)-FLOOR(LOG(S74),1) -> 0.98811284026835111
A75: =A74+0.001 -> 1.0739999999999919 | B75: =LOG(A75) -> 3.1004281363533507E-2 | C75: 1.74 | D75: =LOG(C75)-FLOOR(LOG(C75),1) -> 0.24054924828259971 | E75: 2.7399999999999798 | F75: =LOG(E75)-FLOOR(LOG(E75),1) -> 0.43775056282038477 | G75: 3.7399999999999798 | H75: =LOG(G75)-FLOOR(LOG(G75),1) -> 0.57287160220047784 | I75: 4.7399999999999798 | J75: =LOG(I75)-FLOOR(LOG(I75),1) -> 0.67577834167408324 | K75: 5.7399999999999798 | L75: =LOG(K75)-FLOOR(LOG(K75),1) -> 0.75891189239797197 | M75: 6.7399999999999798 | N75: =LOG(M75)-FLOOR(LOG(M75),1) -> 0.82865989653531857 | O75: 7.7399999999999798 | P75: =LOG(O75)-FLOOR(LOG(O75),1) -> 0.88874096068289143 | Q75: 8.7399999999999807 | R75: =LOG(Q75)-FLOOR(LOG(Q75),1) -> 0.94151143263440207 | S75: 9.7399999999999807 | T75: =LOG(S75)-FLOOR(LOG(S75),1) -> 0.98855895687861461
A76: =A75+0.001 -> 1.0749999999999917 | B76: =LOG(A76) -> 3.1408464251620798E-2 | C76: 1.75 | D76: =LOG(C76)-FLOOR(LOG(C76),1) -> 0.24303804868629444 | E76: 2.74999999999998 | F76: =LOG(E76)-FLOOR(LOG(E76),1) -> 0.43933269383025947 | G76: 3.74999999999998 | H76: =LOG(G76)-FLOOR(LOG(G76),1) -> 0.57403126772771651 | I76: 4.7499999999999796 | J76: =LOG(I76)-FLOOR(LOG(I76),1) -> 0.67669360962486469 | K76: 5.7499999999999796 | L76: =LOG(K76)-FLOOR(LOG(K76),1) -> 0.75966784468962889 | M76: 6.7499999999999796 | N76: =LOG(M76)-FLOOR(LOG(M76),1) -> 0.82930377283102363 | O76: 7.7499999999999796 | P76: =LOG(O76)-FLOOR(LOG(O76),1) -> 0.88930170250630913 | Q76: 8.7499999999999805 | R76: =LOG(Q76)-FLOOR(LOG(Q76),1) -> 0.94200805302231228 | S76: 9.7499999999999805 | T76: =LOG(S76)-FLOOR(LOG(S76),1) -> 0.98900461569853593
A77: =A76+0.001 -> 1.0759999999999916 | B77: =LOG(A77) -> 3.1812271330366994E-2 | C77: 1.76 | D77: =LOG(C77)-FLOOR(LOG(C77),1) -> 0.24551266781414982 | E77: 2.7599999999999798 | F77: =LOG(E77)-FLOOR(LOG(E77),1) -> 0.44090908206521451 | G77: 3.7599999999999798 | H77: =LOG(G77)-FLOOR(LOG(G77),1) -> 0.57518784492765873 | I77: 4.7599999999999802 | J77: =LOG(I77)-FLOOR(LOG(I77),1) -> 0.67760695272049132 | K77: 5.7599999999999802 | L77: =LOG(K77)-FLOOR(LOG(K77),1) -> 0.7604224834232105 | M77: 6.7599999999999802 | N77: =LOG(M77)-FLOOR(LOG(M77),1) -> 0.82994669594163462 | O77: 7.7599999999999802 | P77: =LOG(O77)-FLOOR(LOG(O77),1) -> 0.8898617212581873 | Q77: 8.7599999999999802 | R77: =LOG(Q77)-FLOOR(LOG(Q77),1) -> 0.94250410616807978 | S77: 9.7599999999999802 | T77: =LOG(S77)-FLOOR(LOG(S77),1) -> 0.98944981766669093
A78: =A77+0.001 -> 1.0769999999999915 | B78: =LOG(A78) -> 3.2215703297978168E-2 | C78: 1.77 | D78: =LOG(C78)-FLOOR(LOG(C78),1) -> 0.24797326636180664 | E78: 2.76999999999998 | F78: =LOG(E78)-FLOOR(LOG(E78),1) -> 0.44247976906444542 | G78: 3.76999999999998 | H78: =LOG(G78)-FLOOR(LOG(G78),1) -> 0.57634135020579058 | I78: 4.76999999999998 | J78: =LOG(I78)-FLOOR(LOG(I78),1) -> 0.67851837904011214 | K78: 5.76999999999998 | L78: =LOG(K78)-FLOOR(LOG(K78),1) -> 0.76117581315572991 | M78: 6.76999999999998 | N78: =LOG(M78)-FLOOR(LOG(M78),1) -> 0.83058866868514303 | O78: 7.76999999999998 | P78: =LOG(O78)-FLOOR(LOG(O78),1) -> 0.89042101880091318 | Q78: 8.76999999999998 | R78: =LOG(Q78)-FLOOR(LOG(Q78),1) -> 0.94299959336603956 | S78: 9.76999999999998 | T78: =LOG(S78)-FLOOR(LOG(S78),1) -> 0.98989456371877216
A79: =A78+0.001 -> 1.0779999999999914 | B79: =LOG(A79) -> 3.2618760850716438E-2 | C79: 1.78 | D79: =LOG(C79)-FLOOR(LOG(C79),1) -> 0.250420002308894 | E79: 2.7799999999999798 | F79: =LOG(E79)-FLOOR(LOG(E79),1) -> 0.44404479591807311 | G79: 3.7799999999999798 | H79: =LOG(G79)-FLOOR(LOG(G79),1) -> 0.57749179983722299 | I79: 4.7799999999999798 | J79: =LOG(I79)-FLOOR(LOG(I79),1) -> 0.679427896612117 | K79: 5.7799999999999798 | L79: =LOG(K79)-FLOOR(LOG(K79),1) -> 0.76192783842052758 | M79: 6.7799999999999798 | N79: =LOG(M79)-FLOOR(LOG(M79),1) -> 0.83122969386706202 | O79: 7.7799999999999798 | P79: =LOG(O79)-FLOOR(LOG(O79),1) -> 0.89097959698968776 | Q79: 8.7799999999999798 | R79: =LOG(Q79)-FLOOR(LOG(Q79),1) -> 0.94349451590610156 | S79: 9.7799999999999798 | T79: =LOG(S79)-FLOOR(LOG(S79),1) -> 0.99033885478760053
A80: =A79+0.001 -> 1.0789999999999913 | B80: =LOG(A80) -> 3.3021444682907172E-2 | C80: 1.79 | D80: =LOG(C80)-FLOOR(LOG(C80),1) -> 0.2528530309798932 | E80: 2.7899999999999801 | F80: =LOG(E80)-FLOOR(LOG(E80),1) -> 0.44560420327359446 | G80: 3.7899999999999801 | H80: =LOG(G80)-FLOOR(LOG(G80),1) -> 0.57863920996807006 | I80: 4.7899999999999796 | J80: =LOG(I80)-FLOOR(LOG(I80),1) -> 0.68033551341456133 | K80: 5.7899999999999796 | L80: =LOG(K80)-FLOOR(LOG(K80),1) -> 0.7626785637274347 | M80: 6.7899999999999796 | N80: =LOG(M80)-FLOOR(LOG(M80),1) -> 0.83186977428050035 | O80: 7.7899999999999796 | P80: =LOG(O80)-FLOOR(LOG(O80),1) -> 0.89153745767256332 | Q80: 8.7899999999999796 | R80: =LOG(Q80)-FLOOR(LOG(Q80),1) -> 0.94398887507377094 | S80: 9.7899999999999796 | T80: =LOG(S80)-FLOOR(LOG(S80),1) -> 0.99078269180313694
A81: =A80+0.001 -> 1.0799999999999912 | B81: =LOG(A81) -> 3.3423755486946156E-2 | C81: 1.80 | D81: =LOG(C81)-FLOOR(LOG(C81),1) -> 0.25527250510330607 | E81: 2.7999999999999798 | F81: =LOG(E81)-FLOOR(LOG(E81),1) -> 0.4471580313422161 | G81: 3.7999999999999798 | H81: =LOG(G81)-FLOOR(LOG(G81),1) -> 0.57978359661680789 | I81: 4.7999999999999803 | J81: =LOG(I81)-FLOOR(LOG(I81),1) -> 0.6812412373755854 | K81: 5.7999999999999803 | L81: =LOG(K81)-FLOOR(LOG(K81),1) -> 0.76342799356293578 | M81: 6.7999999999999803 | N81: =LOG(M81)-FLOOR(LOG(M81),1) -> 0.83250891270623506 | O81: 7.7999999999999803 | P81: =LOG(O81)-FLOOR(LOG(O81),1) -> 0.89209460269047935 | Q81: 8.7999999999999794 | R81: =LOG(Q81)-FLOOR(LOG(Q81),1) -> 0.94448267215016757 | S81: 9.7999999999999794 | T81: =LOG(S81)-FLOOR(LOG(S81),1) -> 0.99122607569249399
A82: =A81+0.001 -> 1.0809999999999911 | B82: =LOG(A82) -> 3.3825693953306757E-2 | C82: 1.81 | D82: =LOG(C82)-FLOOR(LOG(C82),1) -> 0.2576785748691845 | E82: 2.8099999999999801 | F82: =LOG(E82)-FLOOR(LOG(E82),1) -> 0.44870631990507681 | G82: 3.8099999999999801 | H82: =LOG(G82)-FLOOR(LOG(G82),1) -> 0.58092497567561707 | I82: 4.8099999999999801 | J82: =LOG(I82)-FLOOR(LOG(I82),1) -> 0.68214507637382993 | K82: 5.8099999999999801 | L82: =LOG(K82)-FLOOR(LOG(K82),1) -> 0.76417613239032922 | M82: 6.8099999999999801 | N82: =LOG(M82)-FLOOR(LOG(M82),1) -> 0.8331471119127839 | O82: 7.8099999999999801 | P82: =LOG(O82)-FLOOR(LOG(O82),1) -> 0.89265103387729927 | Q82: 8.8099999999999792 | R82: =LOG(Q82)-FLOOR(LOG(Q82),1) -> 0.94497590841204693 | S82: 9.8099999999999792 | T82: =LOG(S82)-FLOOR(LOG(S82),1) -> 0.99166900737994756
A83: =A82+0.001 -> 1.081999999999991 | B83: =LOG(A83) -> 3.4227260770547011E-2 | C83: 1.82 | D83: =LOG(C83)-FLOOR(LOG(C83),1) -> 0.26007138798507479 | E83: 2.8199999999999799 | F83: =LOG(E83)-FLOOR(LOG(E83),1) -> 0.45024910831935799 | G83: 3.8199999999999799 | H83: =LOG(G83)-FLOOR(LOG(G83),1) -> 0.58206336291170646 | I83: 4.8199999999999799 | J83: =LOG(I83)-FLOOR(LOG(I83),1) -> 0.68304703823884771 | K83: 5.8199999999999799 | L83: =LOG(K83)-FLOOR(LOG(K83),1) -> 0.76492298464988695 | M83: 6.8199999999999799 | N83: =LOG(M83)-FLOOR(LOG(M83),1) -> 0.83378437465647759 | O83: 7.8199999999999799 | P83: =LOG(O83)-FLOOR(LOG(O83),1) -> 0.89320675305984687 | Q83: 8.8199999999999807 | R83: =LOG(Q83)-FLOOR(LOG(Q83),1) -> 0.94546858513181875 | S83: 9.8199999999999807 | T83: =LOG(S83)-FLOOR(LOG(S83),1) -> 0.9921114877869488
A84: =A83+0.001 -> 1.0829999999999909 | B84: =LOG(A84) -> 3.4628456625316696E-2 | C84: 1.83 | D84: =LOG(C84)-FLOOR(LOG(C84),1) -> 0.26245108973042947 | E84: 2.8299999999999801 | F84: =LOG(E84)-FLOOR(LOG(E84),1) -> 0.45178643552428716 | G84: 3.8299999999999801 | H84: =LOG(G84)-FLOOR(LOG(G84),1) -> 0.58319877396862052 | I84: 4.8299999999999796 | J84: =LOG(I84)-FLOOR(LOG(I84),1) -> 0.68394713075151037 | K84: 5.8299999999999796 | L84: =LOG(K84)-FLOOR(LOG(K84),1) -> 0.76566855475901252 | M84: 6.8299999999999796 | N84: =LOG(M84)-FLOOR(LOG(M84),1) -> 0.83442070368153132 | O84: 7.8299999999999796 | P84: =LOG(O84)-FLOOR(LOG(O84),1) -> 0.89376176205794222 | Q84: 8.8299999999999805 | R84: =LOG(Q84)-FLOOR(LOG(Q84),1) -> 0.94596070357756767 | S84: 9.8299999999999805 | T84: =LOG(S84)-FLOOR(LOG(S84),1) -> 0.99255351783213475
A85: =A84+0.001 -> 1.0839999999999907 | B85: =LOG(A85) -> 3.5029282202364412E-2 | C85: 1.84 | D85: =LOG(C85)-FLOOR(LOG(C85),1) -> 0.26481782300953649 | E85: 2.8399999999999799 | F85: =LOG(E85)-FLOOR(LOG(E85),1) -> 0.45331834004703458 | G85: 3.8399999999999799 | H85: =LOG(G85)-FLOOR(LOG(G85),1) -> 0.58433122436752849 | I85: 4.8399999999999803 | J85: =LOG(I85)-FLOOR(LOG(I85),1) -> 0.68484536164441068 | K85: 5.8399999999999803 | L85: =LOG(K85)-FLOOR(LOG(K85),1) -> 0.76641284711239799 | M85: 6.8399999999999803 | N85: =LOG(M85)-FLOOR(LOG(M85),1) -> 0.83505610172011502 | O85: 7.8399999999999803 | P85: =LOG(O85)-FLOOR(LOG(O85),1) -> 0.89431606268443731 | Q85: 8.8399999999999803 | R85: =LOG(Q85)-FLOOR(LOG(Q85),1) -> 0.94645226501307211 | S85: 9.8399999999999803 | T85: =LOG(S85)-FLOOR(LOG(S85),1) -> 0.99299509843134059
A86: =A85+0.001 -> 1.0849999999999906 | B86: =LOG(A86) -> 3.5429738184544569E-2 | C86: 1.85 | D86: =LOG(C86)-FLOOR(LOG(C86),1) -> 0.26717172840301384 | E86: 2.8499999999999801 | F86: =LOG(E86)-FLOOR(LOG(E86),1) -> 0.45484486000850716 | G86: 3.8499999999999801 | H86: =LOG(G86)-FLOOR(LOG(G86),1) -> 0.58546072950849848 | I86: 4.8499999999999801 | J86: =LOG(I86)-FLOOR(LOG(I86),1) -> 0.68574173860226184 | K86: 5.8499999999999801 | L86: =LOG(K86)-FLOOR(LOG(K86),1) -> 0.76715586608217901 | M86: 6.8499999999999801 | N86: =LOG(M86)-FLOOR(LOG(M86),1) -> 0.83569057149242432 | O86: 7.8499999999999801 | P86: =LOG(O86)-FLOOR(LOG(O86),1) -> 0.89486965674525143 | Q86: 8.8499999999999801 | R86: =LOG(Q86)-FLOOR(LOG(Q86),1) -> 0.94694327069782447 | S86: 9.8499999999999801 | T86: =LOG(S86)-FLOOR(LOG(S86),1) -> 0.99343623049761087
A87: =A86+0.001 -> 1.0859999999999905 | B87: =LOG(A87) -> 3.5829825252824354E-2 | C87: 1.86 | D87: =LOG(C87)-FLOOR(LOG(C87),1) -> 0.26951294421791633 | E87: 2.8599999999999799 | F87: =LOG(E87)-FLOOR(LOG(E87),1) -> 0.45636603312903995 | G87: 3.8599999999999799 | H87: =LOG(G87)-FLOOR(LOG(G87),1) -> 0.58658730467175269 | I87: 4.8599999999999799 | J87: =LOG(I87)-FLOOR(LOG(I87),1) -> 0.6866362692622916 | K87: 5.8599999999999799 | L87: =LOG(K87)-FLOOR(LOG(K87),1) -> 0.76789761601808915 | M87: 6.8599999999999799 | N87: =LOG(M87)-FLOOR(LOG(M87),1) -> 0.83632411570675036 | O87: 7.8599999999999799 | P87: =LOG(O87)-FLOOR(LOG(O87),1) -> 0.89542254603940674 | Q87: 8.8599999999999799 | R87: =LOG(Q87)-FLOOR(LOG(Q87),1) -> 0.94743372188704977 | S87: 9.8599999999999799 | T87: =LOG(S87)-FLOOR(LOG(S87),1) -> 0.99387691494121033
A88: =A87+0.001 -> 1.0869999999999904 | B88: =LOG(A88) -> 3.6229544086290713E-2 | C88: 1.87 | D88: =LOG(C88)-FLOOR(LOG(C88),1) -> 0.27184160653649897 | E88: 2.8699999999999801 | F88: =LOG(E88)-FLOOR(LOG(E88),1) -> 0.45788189673398932 | G88: 3.8699999999999801 | H88: =LOG(G88)-FLOOR(LOG(G88),1) -> 0.58771096501890918 | I88: 4.8699999999999797 | J88: =LOG(I88)-FLOOR(LOG(I88),1) -> 0.68752896121463247 | K88: 5.8699999999999797 | L88: =LOG(K88)-FLOOR(LOG(K88),1) -> 0.768638101247613 | M88: 6.8699999999999797 | N88: =LOG(M88)-FLOOR(LOG(M88),1) -> 0.83695673705954909 | O88: 7.8699999999999797 | P88: =LOG(O88)-FLOOR(LOG(O88),1) -> 0.89597473235906344 | Q88: 8.8699999999999797 | R88: =LOG(Q88)-FLOOR(LOG(Q88),1) -> 0.94792361983172535 | S88: 9.8699999999999797 | T88: =LOG(S88)-FLOOR(LOG(S88),1) -> 0.99431715266963583
A89: =A88+0.001 -> 1.0879999999999903 | B89: =LOG(A89) -> 3.6628895362157229E-2 | C89: 1.88 | D89: =LOG(C89)-FLOOR(LOG(C89),1) -> 0.27415784926367981 | E89: 2.8799999999999799 | F89: =LOG(E89)-FLOOR(LOG(E89),1) -> 0.45939248775922781 | G89: 3.8799999999999799 | H89: =LOG(G89)-FLOOR(LOG(G89),1) -> 0.58883172559420505 | I89: 4.8799999999999804 | J89: =LOG(I89)-FLOOR(LOG(I89),1) -> 0.6884198220027089 | K89: 5.8799999999999804 | L89: =LOG(K89)-FLOOR(LOG(K89),1) -> 0.76937732607613707 | M89: 6.8799999999999804 | N89: =LOG(M89)-FLOOR(LOG(M89),1) -> 0.8375884382355101 | O89: 7.8799999999999804 | P89: =LOG(O89)-FLOOR(LOG(O89),1) -> 0.89652621748955419 | Q89: 8.8799999999999795 | R89: =LOG(Q89)-FLOOR(LOG(Q89),1) -> 0.94841296577860001 | S89: 9.8799999999999795 | T89: =LOG(S89)-FLOOR(LOG(S89),1) -> 0.9947569445876272
A90: =A89+0.001 -> 1.0889999999999902 | B90: =LOG(A90) -> 3.702787975577105E-2 | C90: 1.89 | D90: =LOG(C90)-FLOOR(LOG(C90),1) -> 0.27646180417324412 | E90: 2.8899999999999801 | F90: =LOG(E90)-FLOOR(LOG(E90),1) -> 0.46089784275654488 | G90: 3.8899999999999801 | H90: =LOG(G90)-FLOOR(LOG(G90),1) -> 0.58994960132570551 | I90: 4.8899999999999801 | J90: =LOG(I90)-FLOOR(LOG(I90),1) -> 0.6893088591236185 | K90: 5.8899999999999801 | L90: =LOG(K90)-FLOOR(LOG(K90),1) -> 0.77011529478710017 | M90: 6.8899999999999801 | N90: =LOG(M90)-FLOOR(LOG(M90),1) -> 0.83821922190762455 | O90: 7.8899999999999801 | P90: =LOG(O90)-FLOOR(LOG(O90),1) -> 0.89707700320941919 | Q90: 8.8899999999999793 | R90: =LOG(Q90)-FLOOR(LOG(Q90),1) -> 0.94890176097021273 | S90: 9.8899999999999793 | T90: =LOG(S90)-FLOOR(LOG(S90),1) -> 0.99519629159717848
A91: =A90+0.001 -> 1.0899999999999901 | B91: =LOG(A91) -> 3.7426497940619689E-2 | C91: 1.90 | D91: =LOG(C91)-FLOOR(LOG(C91),1) -> 0.27875360095282892 | E91: 2.8999999999999799 | F91: =LOG(E91)-FLOOR(LOG(E91),1) -> 0.46239799789895308 | G91: 3.8999999999999799 | H91: =LOG(G91)-FLOOR(LOG(G91),1) -> 0.59106460702649699 | I91: 4.8999999999999799 | J91: =LOG(I91)-FLOOR(LOG(I91),1) -> 0.69019608002851185 | K91: 5.8999999999999799 | L91: =LOG(K91)-FLOOR(LOG(K91),1) -> 0.77085201164214268 | M91: 6.8999999999999799 | N91: =LOG(M91)-FLOOR(LOG(M91),1) -> 0.838849090737254 | O91: 7.8999999999999799 | P91: =LOG(O91)-FLOOR(LOG(O91),1) -> 0.89762709129044027 | Q91: 8.8999999999999808 | R91: =LOG(Q91)-FLOOR(LOG(Q91),1) -> 0.9493900066449118 | S91: 9.8999999999999808 | T91: =LOG(S91)-FLOOR(LOG(S91),1) -> 0.99563519459754912
A92: =A91+0.001 -> 1.09099999999999 | B92: =LOG(A92) -> 3.782475058833789E-2 | C92: 1.91 | D92: =LOG(C92)-FLOOR(LOG(C92),1) -> 0.28103336724772754 | E92: 2.9099999999999802 | F92: =LOG(E92)-FLOOR(LOG(E92),1) -> 0.46389298898590431 | G92: 3.9099999999999802 | H92: =LOG(G92)-FLOOR(LOG(G92),1) -> 0.59217675739586462 | I92: 4.9099999999999797 | J92: =LOG(I92)-FLOOR(LOG(I92),1) -> 0.69108149212296666 | K92: 5.9099999999999797 | L92: =LOG(K92)-FLOOR(LOG(K92),1) -> 0.77158748088125384 | M92: 6.9099999999999797 | N92: =LOG(M92)-FLOOR(LOG(M92),1) -> 0.83947804737419718 | O92: 7.9099999999999797 | P92: =LOG(O92)-FLOOR(LOG(O92),1) -> 0.89817648349767543 | Q92: 8.9099999999999806 | R92: =LOG(Q92)-FLOOR(LOG(Q92),1) -> 0.94987770403687388 | S92: 9.9099999999999806 | T92: =LOG(S92)-FLOOR(LOG(S92),1) -> 0.99607365448527452
A93: =A92+0.001 -> 1.0919999999999899 | B93: =LOG(A93) -> 3.8222638368714396E-2 | C93: 1.92 | D93: =LOG(C93)-FLOOR(LOG(C93),1) -> 0.28330122870354957 | E93: 2.9199999999999799 | F93: =LOG(E93)-FLOOR(LOG(E93),1) -> 0.46538285144841529 | G93: 3.9199999999999799 | H93: =LOG(G93)-FLOOR(LOG(G93),1) -> 0.59328606702045505 | I93: 4.9199999999999804 | J93: =LOG(I93)-FLOOR(LOG(I93),1) -> 0.69196510276735856 | K93: 5.9199999999999804 | L93: =LOG(K93)-FLOOR(LOG(K93),1) -> 0.77232170672291833 | M93: 6.9199999999999804 | N93: =LOG(M93)-FLOOR(LOG(M93),1) -> 0.84010609445675655 | O93: 7.9199999999999804 | P93: =LOG(O93)-FLOOR(LOG(O93),1) -> 0.89872518158949244 | Q93: 8.9199999999999804 | R93: =LOG(Q93)-FLOOR(LOG(Q93),1) -> 0.95036485437612206 | S93: 9.9199999999999804 | T93: =LOG(S93)-FLOOR(LOG(S93),1) -> 0.9965116721541778
A94: =A93+0.001 -> 1.0929999999999898 | B94: =LOG(A94) -> 3.8620161949698723E-2 | C94: 1.93 | D94: =LOG(C94)-FLOOR(LOG(C94),1) -> 0.28555730900777376 | E94: 2.9299999999999802 | F94: =LOG(E94)-FLOOR(LOG(E94),1) -> 0.46686762035410651 | G94: 3.9299999999999802 | H94: =LOG(G94)-FLOOR(LOG(G94),1) -> 0.59439255037542449 | I94: 4.9299999999999802 | J94: =LOG(I94)-FLOOR(LOG(I94),1) -> 0.6928469192772283 | K94: 5.9299999999999802 | L94: =LOG(K94)-FLOOR(LOG(K94),1) -> 0.77305469336426114 | M94: 6.9299999999999802 | N94: =LOG(M94)-FLOOR(LOG(M94),1) -> 0.84073323461180549 | O94: 7.9299999999999802 | P94: =LOG(O94)-FLOOR(LOG(O94),1) -> 0.89927318731760275 | Q94: 8.9299999999999802 | R94: =LOG(Q94)-FLOOR(LOG(Q94),1) -> 0.9508514588885455 | S94: 9.9299999999999802 | T94: =LOG(S94)-FLOOR(LOG(S94),1) -> 0.99694924849538036
A95: =A94+0.001 -> 1.0939999999999896 | B95: =LOG(A95) -> 3.9017321997407858E-2 | C95: 1.94 | D95: =LOG(C95)-FLOOR(LOG(C95),1) -> 0.28780172993022601 | E95: 2.93999999999998 | F95: =LOG(E95)-FLOOR(LOG(E95),1) -> 0.46834733041215432 | G95: 3.93999999999998 | H95: =LOG(G95)-FLOOR(LOG(G95),1) -> 0.59549622182557194 | I95: 4.93999999999998 | J95: =LOG(I95)-FLOOR(LOG(I95),1) -> 0.69372694892364517 | K95: 5.93999999999998 | L95: =LOG(K95)-FLOOR(LOG(K95),1) -> 0.77378644498119209 | M95: 6.93999999999998 | N95: =LOG(M95)-FLOOR(LOG(M95),1) -> 0.84135947045485371 | O95: 7.93999999999998 | P95: =LOG(O95)-FLOOR(LOG(O95),1) -> 0.89982050242709521 | Q95: 8.93999999999998 | R95: =LOG(Q95)-FLOOR(LOG(Q95),1) -> 0.95133751879591666 | S95: 9.93999999999998 | T95: =LOG(S95)-FLOOR(LOG(S95),1) -> 0.99738638439731242
A96: =A95+0.001 -> 1.0949999999999895 | B96: =LOG(A96) -> 3.9414119176132995E-2 | C96: 1.95 | D96: =LOG(C96)-FLOOR(LOG(C96),1) -> 0.29003461136251801 | E96: 2.9499999999999802 | F96: =LOG(E96)-FLOOR(LOG(E96),1) -> 0.46982201597816009 | G96: 3.9499999999999802 | H96: =LOG(G96)-FLOOR(LOG(G96),1) -> 0.59659709562645802 | I96: 4.9499999999999797 | J96: =LOG(I96)-FLOOR(LOG(I96),1) -> 0.69460519893356698 | K96: 5.9499999999999797 | L96: =LOG(K96)-FLOOR(LOG(K96),1) -> 0.77451696572854811 | M96: 6.9499999999999797 | N96: =LOG(M96)-FLOOR(LOG(M96),1) -> 0.8419848045901126 | O96: 7.9499999999999797 | P96: =LOG(O96)-FLOOR(LOG(O96),1) -> 0.90036712865646917 | Q96: 8.9499999999999797 | R96: =LOG(Q96)-FLOOR(LOG(Q96),1) -> 0.95182303531591095 | S96: 9.9499999999999797 | T96: =LOG(S96)-FLOOR(LOG(S96),1) -> 0.99782308074572457
A97: =A96+0.001 -> 1.0959999999999894 | B97: =LOG(A97) -> 3.9810554148346167E-2 | C97: 1.96 | D97: =LOG(C97)-FLOOR(LOG(C97),1) -> 0.29225607135647602 | E97: 2.95999999999998 | F97: =LOG(E97)-FLOOR(LOG(E97),1) -> 0.47129171105893564 | G97: 3.95999999999998 | H97: =LOG(G97)-FLOOR(LOG(G97),1) -> 0.59769518592551008 | I97: 4.9599999999999804 | J97: =LOG(I97)-FLOOR(LOG(I97),1) -> 0.69548167649019577 | K97: 5.9599999999999804 | L97: =LOG(K97)-FLOOR(LOG(K97),1) -> 0.77524625974023498 | M97: 6.9599999999999804 | N97: =LOG(M97)-FLOOR(LOG(M97),1) -> 0.84260923961056089 | O97: 7.9599999999999804 | P97: =LOG(O97)-FLOOR(LOG(O97),1) -> 0.90091306773766799 | Q97: 8.9599999999999795 | R97: =LOG(Q97)-FLOOR(LOG(Q97),1) -> 0.95230800966212426 | S97: 9.9599999999999795 | T97: =LOG(S97)-FLOOR(LOG(S97),1) -> 0.99825933842369785
A98: =A97+0.001 -> 1.0969999999999893 | B98: =LOG(A98) -> 4.0206627574706902E-2 | C98: 1.97 | D98: =LOG(C98)-FLOOR(LOG(C98),1) -> 0.2944662261615929 | E98: 2.9699999999999802 | F98: =LOG(E98)-FLOOR(LOG(E98),1) -> 0.47275644931720945 | G98: 3.9699999999999802 | H98: =LOG(G98)-FLOOR(LOG(G98),1) -> 0.59879050676311285 | I98: 4.9699999999999802 | J98: =LOG(I98)-FLOOR(LOG(I98),1) -> 0.69635638873333039 | K98: 5.9699999999999802 | L98: =LOG(K98)-FLOOR(LOG(K98),1) -> 0.77597433112936764 | M98: 6.9699999999999802 | N98: =LOG(M98)-FLOOR(LOG(M98),1) -> 0.84323277809800823 | O98: 7.9699999999999802 | P98: =LOG(O98)-FLOOR(LOG(O98),1) -> 0.90145832139611126 | Q98: 8.9699999999999793 | R98: =LOG(Q98)-FLOOR(LOG(Q98),1) -> 0.95279244304409105 | S98: 9.9699999999999793 | T98: =LOG(S98)-FLOOR(LOG(S98),1) -> 0.99869515831165478
A99: =A98+0.001 -> 1.0979999999999892 | B99: =LOG(A99) -> 4.0602340114068831E-2 | C99: 1.98 | D99: =LOG(C99)-FLOOR(LOG(C99),1) -> 0.2966651902615311 | E99: 2.97999999999998 | F99: =LOG(E99)-FLOOR(LOG(E99),1) -> 0.47421626407625234 | G99: 3.97999999999998 | H99: =LOG(G99)-FLOOR(LOG(G99),1) -> 0.59988307207368563 | I99: 4.97999999999998 | J99: =LOG(I99)-FLOOR(LOG(I99),1) -> 0.69722934275971582 | K99: 5.97999999999998 | L99: =LOG(K99)-FLOOR(LOG(K99),1) -> 0.77670118398840937 | M99: 6.97999999999998 | N99: =LOG(M99)-FLOOR(LOG(M99),1) -> 0.84385542262315982 | O99: 7.97999999999998 | P99: =LOG(O99)-FLOOR(LOG(O99),1) -> 0.90200289135072831 | Q99: 8.9799999999999809 | R99: =LOG(Q99)-FLOOR(LOG(Q99),1) -> 0.95327633666730349 | S99: 9.9799999999999809 | T99: =LOG(S99)-FLOOR(LOG(S99),1) -> 0.99913054128737033
A100: =A99+0.001 -> 1.0989999999999891 | B100: =LOG(A100) -> 4.0997692423486262E-2 | C100: 1.99 | D100: =LOG(C100)-FLOOR(LOG(C100),1) -> 0.29885307640970665 | E100: 2.99 | F100: =LOG(E100)-FLOOR(LOG(E100),1) -> 0.47567118832442956 | G100: 3.9899999999999798 | H100: =LOG(G100)-FLOOR(LOG(G100),1) -> 0.60097289568674606 | I100: 4.9899999999999798 | J100: =LOG(I100)-FLOOR(LOG(I100),1) -> 0.69810054562338819 | K100: 5.9899999999999798 | L100: =LOG(K100)-FLOOR(LOG(K100),1) -> 0.77742682238930993 | M100: 6.9899999999999798 | N100: =LOG(M100)-FLOOR(LOG(M100),1) -> 0.84447717574568015 | O100: 7.9899999999999798 | P100: =LOG(O100)-FLOOR(LOG(O100),1) -> 0.9025467793139903 | Q100: 8.9899999999999807 | R100: =LOG(Q100)-FLOOR(LOG(Q100),1) -> 0.95375969173322783 | S100: 9.9899999999999807 | T100: =LOG(S100)-FLOOR(LOG(S100),1) -> 0.99956548822598146

A1: <!-- google_ad_client = "ca-pub-0120177304734599"; /* bottomL350x200 */ google_ad_slot = "9059344227"; google_ad_width = 300; google_ad_height = 250; //--> | C1: <!-- google_ad_client = "ca-pub-0120177304734599"; /* bottomR350x200 */ google_ad_slot = "1536077426"; google_ad_width = 300; google_ad_height = 250; //-->