A1: <!-- google_ad_client = "ca-pub-0120177304734599"; /* top728x90 */ google_ad_slot = "4247478622"; google_ad_width = 728; google_ad_height = 90; //--> | C1: <!-- google_ad_client = "ca-pub-0120177304734599"; /* top160x90 */ google_ad_slot = "4107877822"; google_ad_width = 160; google_ad_height = 90; //-->

A2: 0 | B2: 0 | C2: 0 | D2: 1 | E2: 0
E5: 1
C8: 1 | D8: 0 | E8: (undefined)

A1: Degrees | B1: Radian Measure | C1: Sin | D1: Cos | E1: Tan | G1: Degrees | H1: Radian Measure | I1: Sin | J1: Cos | K1: Tan
A2: 0 | B2: =A2*PI()/180 -> 0.00000 | C2: =SIN(B2) -> 0.00000 | D2: =COS(B2) -> 1.00000 | E2: =TAN(B2) -> 0.00000 | G2: 46 | H2: =G2*PI()/180 -> 0.80285145591739149 | I2: =SIN(H2) -> 0.71933980033865108 | J2: =COS(H2) -> 0.69465837045899737 | K2: =TAN(H2) -> 1.0355303137905694
A3: 1 | B3: =A3*PI()/180 -> 1.7453292519943295E-2 | C3: =SIN(B3) -> 1.7452406437283512E-2 | D3: =COS(B3) -> 0.99984769515639127 | E3: =TAN(B3) -> 1.7455064928217585E-2 | G3: 47 | H3: =G3*PI()/180 -> 0.82030474843733492 | I3: =SIN(H3) -> 0.73135370161917046 | J3: =COS(H3) -> 0.68199836006249848 | K3: =TAN(H3) -> 1.0723687100246826
A4: 2 | B4: =A4*PI()/180 -> 3.4906585039886591E-2 | C4: =SIN(B4) -> 3.4899496702500969E-2 | D4: =COS(B4) -> 0.99939082701909576 | E4: =TAN(B4) -> 3.492076949174773E-2 | G4: 48 | H4: =G4*PI()/180 -> 0.83775804095727813 | I4: =SIN(H4) -> 0.74314482547739413 | J4: =COS(H4) -> 0.66913060635885824 | K4: =TAN(H4) -> 1.1106125148291928
A5: 3 | B5: =A5*PI()/180 -> 5.2359877559829883E-2 | C5: =SIN(B5) -> 5.2335956242943828E-2 | D5: =COS(B5) -> 0.99862953475457383 | E5: =TAN(B5) -> 5.2407779283041196E-2 | G5: 49 | H5: =G5*PI()/180 -> 0.85521133347722145 | I5: =SIN(H5) -> 0.75470958022277201 | J5: =COS(H5) -> 0.65605902899050728 | K5: =TAN(H5) -> 1.1503684072210094
A6: 4 | B6: =A6*PI()/180 -> 6.9813170079773182E-2 | C6: =SIN(B6) -> 6.9756473744125302E-2 | D6: =COS(B6) -> 0.9975640502598242 | E6: =TAN(B6) -> 6.9926811943510414E-2 | G6: 50 | H6: =G6*PI()/180 -> 0.87266462599716477 | I6: =SIN(H6) -> 0.76604444311897801 | J6: =COS(H6) -> 0.64278760968653936 | K6: =TAN(H6) -> 1.19175359259421
A7: 5 | B7: =A7*PI()/180 -> 8.7266462599716474E-2 | C7: =SIN(B7) -> 8.7155742747658166E-2 | D7: =COS(B7) -> 0.99619469809174555 | E7: =TAN(B7) -> 8.7488663525924007E-2 | G7: 51 | H7: =G7*PI()/180 -> 0.89011791851710798 | I7: =SIN(H7) -> 0.77714596145697079 | J7: =COS(H7) -> 0.6293203910498375 | K7: =TAN(H7) -> 1.2348971565350511
A8: 6 | B8: =A8*PI()/180 -> 0.10471975511965977 | C8: =SIN(B8) -> 0.10452846326765346 | D8: =COS(B8) -> 0.99452189536827329 | E8: =TAN(B8) -> 0.10510423526567646 | G8: 52 | H8: =G8*PI()/180 -> 0.90757121103705141 | I8: =SIN(H8) -> 0.78801075360672201 | J8: =COS(H8) -> 0.61566147532565829 | K8: =TAN(H8) -> 1.2799416321930788
A9: 7 | B9: =A9*PI()/180 -> 0.12217304763960307 | C9: =SIN(B9) -> 0.12186934340514748 | D9: =COS(B9) -> 0.99254615164132198 | E9: =TAN(B9) -> 0.1227845609029046 | G9: 53 | H9: =G9*PI()/180 -> 0.92502450355699462 | I9: =SIN(H9) -> 0.79863551004729283 | J9: =COS(H9) -> 0.60181502315204838 | K9: =TAN(H9) -> 1.3270448216204098
A10: 8 | B10: =A10*PI()/180 -> 0.13962634015954636 | C10: =SIN(B10) -> 0.13917310096006544 | D10: =COS(B10) -> 0.99026806874157036 | E10: =TAN(B10) -> 0.14054083470239145 | G10: 54 | H10: =G10*PI()/180 -> 0.94247779607693793 | I10: =SIN(H10) -> 0.80901699437494745 | J10: =COS(H10) -> 0.58778525229247314 | K10: =TAN(H10) -> 1.3763819204711734
A11: 9 | B11: =A11*PI()/180 -> 0.15707963267948966 | C11: =SIN(B11) -> 0.15643446504023087 | D11: =COS(B11) -> 0.98768834059513777 | E11: =TAN(B11) -> 0.15838444032453627 | G11: 55 | H11: =G11*PI()/180 -> 0.95993108859688125 | I11: =SIN(H11) -> 0.8191520442889918 | J11: =COS(H11) -> 0.57357643635104616 | K11: =TAN(H11) -> 1.4281480067421144
A12: 10 | B12: =A12*PI()/180 -> 0.17453292519943295 | C12: =SIN(B12) -> 0.17364817766693033 | D12: =COS(B12) -> 0.98480775301220802 | E12: =TAN(B12) -> 0.17632698070846498 | G12: 56 | H12: =G12*PI()/180 -> 0.97738438111682457 | I12: =SIN(H12) -> 0.82903757255504174 | J12: =COS(H12) -> 0.55919290347074679 | K12: =TAN(H12) -> 1.4825609685127403
A13: 11 | B13: =A13*PI()/180 -> 0.19198621771937624 | C13: =SIN(B13) -> 0.1908089953765448 | D13: =COS(B13) -> 0.98162718344766398 | E13: =TAN(B13) -> 0.19438030913771848 | G13: 57 | H13: =G13*PI()/180 -> 0.99483767363676778 | I13: =SIN(H13) -> 0.83867056794542394 | J13: =COS(H13) -> 0.5446390350150272 | K13: =TAN(H13) -> 1.5398649638145827
A14: 12 | B14: =A14*PI()/180 -> 0.20943951023931953 | C14: =SIN(B14) -> 0.20791169081775931 | D14: =COS(B14) -> 0.97814760073380569 | E14: =TAN(B14) -> 0.2125565616700221 | G14: 58 | H14: =G14*PI()/180 -> 1.0122909661567112 | I14: =SIN(H14) -> 0.84804809615642596 | J14: =COS(H14) -> 0.5299192642332049 | K14: =TAN(H14) -> 1.6003345290410507
A15: 13 | B15: =A15*PI()/180 -> 0.22689280275926285 | C15: =SIN(B15) -> 0.224951054343865 | D15: =COS(B15) -> 0.97437006478523525 | E15: =TAN(B15) -> 0.23086819112556312 | G15: 59 | H15: =G15*PI()/180 -> 1.0297442586766543 | I15: =SIN(H15) -> 0.85716730070211222 | J15: =COS(H15) -> 0.51503807491005438 | K15: =TAN(H15) -> 1.6642794823505174
A16: 14 | B16: =A16*PI()/180 -> 0.24434609527920614 | C16: =SIN(B16) -> 0.24192189559966773 | D16: =COS(B16) -> 0.97029572627599647 | E16: =TAN(B16) -> 0.24932800284318068 | G16: 60 | H16: =G16*PI()/180 -> 1.0471975511965976 | I16: =SIN(H16) -> 0.8660254037844386 | J16: =COS(H16) -> 00.5 | K16: =TAN(H16) -> 1.7320508075688767
A17: 15 | B17: =A17*PI()/180 -> 0.26179938779914941 | C17: =SIN(B17) -> 0.25881904510252074 | D17: =COS(B17) -> 0.96592582628906831 | E17: =TAN(B17) -> 0.2679491924311227 | G17: 61 | H17: =G17*PI()/180 -> 1.064650843716541 | I17: =SIN(H17) -> 0.87461970713939574 | J17: =COS(H17) -> 0.48480962024633711 | K17: =TAN(H17) -> 1.8040477552714236
A18: 16 | B18: =A18*PI()/180 -> 0.27925268031909273 | C18: =SIN(B18) -> 0.27563735581699916 | D18: =COS(B18) -> 0.96126169593831889 | E18: =TAN(B18) -> 0.28674538575880792 | G18: 62 | H18: =G18*PI()/180 -> 1.0821041362364843 | I18: =SIN(H18) -> 0.88294759285892688 | J18: =COS(H18) -> 0.46947156278589086 | K18: =TAN(H18) -> 1.8807264653463318
A19: 17 | B19: =A19*PI()/180 -> 0.29670597283903605 | C19: =SIN(B19) -> 0.29237170472273677 | D19: =COS(B19) -> 0.95630475596303544 | E19: =TAN(B19) -> 0.30573068145866039 | G19: 63 | H19: =G19*PI()/180 -> 1.0995574287564276 | I19: =SIN(H19) -> 0.89100652418836779 | J19: =COS(H19) -> 0.4539904997395468 | K19: =TAN(H19) -> 1.9626105055051504
A20: 18 | B20: =A20*PI()/180 -> 0.31415926535897931 | C20: =SIN(B20) -> 0.3090169943749474 | D20: =COS(B20) -> 0.95105651629515353 | E20: =TAN(B20) -> 0.32491969623290629 | G20: 64 | H20: =G20*PI()/180 -> 1.1170107212763709 | I20: =SIN(H20) -> 0.89879404629916704 | J20: =COS(H20) -> 0.43837114678907746 | K20: =TAN(H20) -> 2.050303841579296
A21: 19 | B21: =A21*PI()/180 -> 0.33161255787892258 | C21: =SIN(B21) -> 0.32556815445715664 | D21: =COS(B21) -> 0.94551857559931685 | E21: =TAN(B21) -> 0.34432761328966521 | G21: 65 | H21: =G21*PI()/180 -> 1.1344640137963142 | I21: =SIN(H21) -> 0.90630778703664994 | J21: =COS(H21) -> 0.42261826174069944 | K21: =TAN(H21) -> 2.1445069205095586
A22: 20 | B22: =A22*PI()/180 -> 0.3490658503988659 | C22: =SIN(B22) -> 0.34202014332566871 | D22: =COS(B22) -> 0.93969262078590843 | E22: =TAN(B22) -> 0.36397023426620234 | G22: 66 | H22: =G22*PI()/180 -> 1.1519173063162575 | I22: =SIN(H22) -> 0.91354545764260087 | J22: =COS(H22) -> 0.40673664307580021 | K22: =TAN(H22) -> 2.2460367739042164
A23: 21 | B23: =A23*PI()/180 -> 0.36651914291880922 | C23: =SIN(B23) -> 0.35836794954530027 | D23: =COS(B23) -> 0.93358042649720174 | E23: =TAN(B23) -> 0.38386403503541577 | G23: 67 | H23: =G23*PI()/180 -> 1.1693705988362006 | I23: =SIN(H23) -> 0.92050485345244026 | J23: =COS(H23) -> 0.39073112848927394 | K23: =TAN(H23) -> 2.3558523658237518
A24: 22 | B24: =A24*PI()/180 -> 0.38397243543875248 | C24: =SIN(B24) -> 0.37460659341591201 | D24: =COS(B24) -> 0.92718385456678742 | E24: =TAN(B24) -> 0.40402622583515679 | G24: 68 | H24: =G24*PI()/180 -> 1.1868238913561442 | I24: =SIN(H24) -> 0.92718385456678742 | J24: =COS(H24) -> 0.37460659341591196 | K24: =TAN(H24) -> 2.4750868534162964
A25: 23 | B25: =A25*PI()/180 -> 0.40142572795869574 | C25: =SIN(B25) -> 0.39073112848927372 | D25: =COS(B25) -> 0.92050485345244037 | E25: =TAN(B25) -> 0.4244748162096047 | G25: 69 | H25: =G25*PI()/180 -> 1.2042771838760873 | I25: =SIN(H25) -> 0.93358042649720174 | J25: =COS(H25) -> 0.35836794954530038 | K25: =TAN(H25) -> 2.6050890646938005
A26: 24 | B26: =A26*PI()/180 -> 0.41887902047863906 | C26: =SIN(B26) -> 0.40673664307580015 | D26: =COS(B26) -> 0.91354545764260087 | E26: =TAN(B26) -> 0.4452286853085361 | G26: 70 | H26: =G26*PI()/180 -> 1.2217304763960306 | I26: =SIN(H26) -> 0.93969262078590832 | J26: =COS(H26) -> 0.34202014332566882 | K26: =TAN(H26) -> 2.7474774194546216
A27: 25 | B27: =A27*PI()/180 -> 0.43633231299858238 | C27: =SIN(B27) -> 0.42261826174069944 | D27: =COS(B27) -> 0.90630778703664994 | E27: =TAN(B27) -> 0.46630765815499858 | G27: 71 | H27: =G27*PI()/180 -> 1.2391837689159739 | I27: =SIN(H27) -> 0.94551857559931674 | J27: =COS(H27) -> 0.32556815445715676 | K27: =TAN(H27) -> 2.9042108776758222
A28: 26 | B28: =A28*PI()/180 -> 0.4537856055185257 | C28: =SIN(B28) -> 0.4383711467890774 | D28: =COS(B28) -> 0.89879404629916704 | E28: =TAN(B28) -> 0.48773258856586144 | G28: 72 | H28: =G28*PI()/180 -> 1.2566370614359172 | I28: =SIN(H28) -> 0.95105651629515353 | J28: =COS(H28) -> 0.30901699437494745 | K28: =TAN(H28) -> 3.0776835371752527
A29: 27 | B29: =A29*PI()/180 -> 0.47123889803846897 | C29: =SIN(B29) -> 0.45399049973954675 | D29: =COS(B29) -> 0.8910065241883679 | E29: =TAN(B29) -> 0.50952544949442879 | G29: 73 | H29: =G29*PI()/180 -> 1.2740903539558606 | I29: =SIN(H29) -> 0.95630475596303544 | J29: =COS(H29) -> 0.29237170472273677 | K29: =TAN(H29) -> 3.2708526184841404
A30: 28 | B30: =A30*PI()/180 -> 0.48869219055841229 | C30: =SIN(B30) -> 0.46947156278589081 | D30: =COS(B30) -> 0.88294759285892699 | E30: =TAN(B30) -> 0.53170943166147877 | G30: 74 | H30: =G30*PI()/180 -> 1.2915436464758039 | I30: =SIN(H30) -> 0.96126169593831889 | J30: =COS(H30) -> 0.27563735581699916 | K30: =TAN(H30) -> 3.4874144438409087
A31: 29 | B31: =A31*PI()/180 -> 0.50614548307835561 | C31: =SIN(B31) -> 0.48480962024633706 | D31: =COS(B31) -> 0.87461970713939574 | E31: =TAN(B31) -> 0.55430905145276899 | G31: 75 | H31: =G31*PI()/180 -> 1.3089969389957472 | I31: =SIN(H31) -> 0.96592582628906831 | J31: =COS(H31) -> 0.25881904510252074 | K31: =TAN(H31) -> 3.7320508075688776
A32: 30 | B32: =A32*PI()/180 -> 0.52359877559829882 | C32: =SIN(B32) -> 00.5 | D32: =COS(B32) -> 0.86602540378443871 | E32: =TAN(B32) -> 0.57735026918962573 | G32: 76 | H32: =G32*PI()/180 -> 1.3264502315156903 | I32: =SIN(H32) -> 0.97029572627599647 | J32: =COS(H32) -> 0.2419218955996679 | K32: =TAN(H32) -> 4.010780933535842
A33: 31 | B33: =A33*PI()/180 -> 0.54105206811824214 | C33: =SIN(B33) -> 0.51503807491005416 | D33: =COS(B33) -> 0.85716730070211233 | E33: =TAN(B33) -> 0.60086061902756038 | G33: 77 | H33: =G33*PI()/180 -> 1.3439035240356338 | I33: =SIN(H33) -> 0.97437006478523525 | J33: =COS(H33) -> 0.22495105434386492 | K33: =TAN(H33) -> 4.3314758742841573
A34: 32 | B34: =A34*PI()/180 -> 0.55850536063818546 | C34: =SIN(B34) -> 0.5299192642332049 | D34: =COS(B34) -> 0.84804809615642596 | E34: =TAN(B34) -> 0.62486935190932746 | G34: 78 | H34: =G34*PI()/180 -> 1.3613568165555769 | I34: =SIN(H34) -> 0.97814760073380558 | J34: =COS(H34) -> 0.20791169081775945 | K34: =TAN(H34) -> 4.7046301094784511
A35: 33 | B35: =A35*PI()/180 -> 0.57595865315812877 | C35: =SIN(B35) -> 0.54463903501502708 | D35: =COS(B35) -> 0.83867056794542405 | E35: =TAN(B35) -> 0.64940759319751062 | G35: 79 | H35: =G35*PI()/180 -> 1.3788101090755203 | I35: =SIN(H35) -> 0.98162718344766398 | J35: =COS(H35) -> 0.19080899537654492 | K35: =TAN(H35) -> 5.1445540159703071
A36: 34 | B36: =A36*PI()/180 -> 0.59341194567807209 | C36: =SIN(B36) -> 0.5591929034707469 | D36: =COS(B36) -> 0.82903757255504162 | E36: =TAN(B36) -> 0.67450851684242674 | G36: 80 | H36: =G36*PI()/180 -> 1.3962634015954636 | I36: =SIN(H36) -> 0.98480775301220802 | J36: =COS(H36) -> 0.17364817766693041 | K36: =TAN(H36) -> 5.6712818196177066
A37: 35 | B37: =A37*PI()/180 -> 0.6108652381980153 | C37: =SIN(B37) -> 0.57357643635104605 | D37: =COS(B37) -> 0.8191520442889918 | E37: =TAN(B37) -> 0.70020753820970971 | G37: 81 | H37: =G37*PI()/180 -> 1.4137166941154069 | I37: =SIN(H37) -> 0.98768834059513777 | J37: =COS(H37) -> 0.15643446504023092 | K37: =TAN(H37) -> 6.3137515146750411
A38: 36 | B38: =A38*PI()/180 -> 0.62831853071795862 | C38: =SIN(B38) -> 0.58778525229247314 | D38: =COS(B38) -> 0.80901699437494745 | E38: =TAN(B38) -> 0.7265425280053609 | G38: 82 | H38: =G38*PI()/180 -> 1.43116998663535 | I38: =SIN(H38) -> 0.99026806874157025 | J38: =COS(H38) -> 0.13917310096006569 | K38: =TAN(H38) -> 7.1153697223841954
A39: 37 | B39: =A39*PI()/180 -> 0.64577182323790194 | C39: =SIN(B39) -> 0.60181502315204827 | D39: =COS(B39) -> 0.79863551004729283 | E39: =TAN(B39) -> 0.75355405010279419 | G39: 83 | H39: =G39*PI()/180 -> 1.4486232791552935 | I39: =SIN(H39) -> 0.99254615164132198 | J39: =COS(H39) -> 0.12186934340514749 | K39: =TAN(H39) -> 8.1443464279745932
A40: 38 | B40: =A40*PI()/180 -> 0.66322511575784515 | C40: =SIN(B40) -> 0.61566147532565818 | D40: =COS(B40) -> 0.78801075360672201 | E40: =TAN(B40) -> 0.78128562650671729 | G40: 84 | H40: =G40*PI()/180 -> 1.4660765716752369 | I40: =SIN(H40) -> 0.99452189536827329 | J40: =COS(H40) -> 0.10452846326765346 | K40: =TAN(H40) -> 9.5143644542225871
A41: 39 | B41: =A41*PI()/180 -> 0.68067840827778847 | C41: =SIN(B41) -> 0.62932039104983739 | D41: =COS(B41) -> 0.7771459614569709 | E41: =TAN(B41) -> 0.80978403319500702 | G41: 85 | H41: =G41*PI()/180 -> 1.4835298641951802 | I41: =SIN(H41) -> 0.99619469809174555 | J41: =COS(H41) -> 8.7155742747658138E-2 | K41: =TAN(H41) -> 11.430052302761348
A42: 40 | B42: =A42*PI()/180 -> 0.69813170079773179 | C42: =SIN(B42) -> 0.64278760968653925 | D42: =COS(B42) -> 0.76604444311897801 | E42: =TAN(B42) -> 0.83909963117727993 | G42: 86 | H42: =G42*PI()/180 -> 1.5009831567151233 | I42: =SIN(H42) -> 0.9975640502598242 | J42: =COS(H42) -> 6.9756473744125455E-2 | K42: =TAN(H42) -> 14.300666256711896
A43: 41 | B43: =A43*PI()/180 -> 0.715584993317675 | C43: =SIN(B43) -> 0.65605902899050716 | D43: =COS(B43) -> 0.75470958022277213 | E43: =TAN(B43) -> 0.86928673781622645 | G43: 87 | H43: =G43*PI()/180 -> 1.5184364492350666 | I43: =SIN(H43) -> 0.99862953475457383 | J43: =COS(H43) -> 5.2335956242943966E-2 | K43: =TAN(H43) -> 19.081136687728161
A44: 42 | B44: =A44*PI()/180 -> 0.73303828583761843 | C44: =SIN(B44) -> 0.66913060635885824 | D44: =COS(B44) -> 0.74314482547739424 | E44: =TAN(B44) -> 0.90040404429783993 | G44: 88 | H44: =G44*PI()/180 -> 1.5358897417550099 | I44: =SIN(H44) -> 0.99939082701909576 | J44: =COS(H44) -> 3.489949670250108E-2 | K44: =TAN(H44) -> 28.636253282915515
A45: 43 | B45: =A45*PI()/180 -> 0.75049157835756164 | C45: =SIN(B45) -> 0.68199836006249848 | D45: =COS(B45) -> 0.73135370161917057 | E45: =TAN(B45) -> 0.93251508613766154 | G45: 89 | H45: =G45*PI()/180 -> 1.5533430342749535 | I45: =SIN(H45) -> 0.99984769515639127 | J45: =COS(H45) -> 1.7452406437283376E-2 | K45: =TAN(H45) -> 57.289961630759876
A46: 44 | B46: =A46*PI()/180 -> 0.76794487087750496 | C46: =SIN(B46) -> 0.69465837045899725 | D46: =COS(B46) -> 0.71933980033865119 | E46: =TAN(B46) -> 0.96568877480707394 | G46: 90 | H46: =G46*PI()/180 -> 1.5707963267948966 | I46: =SIN(H46) -> 1.00000 | J46: =COS(H46) -> 6.1257422745431001E-17
A47: 45 | B47: =A47*PI()/180 -> 0.78539816339744828 | C47: =SIN(B47) -> 0.70710678118654746 | D47: =COS(B47) -> 0.70710678118654757 | E47: =TAN(B47) -> 1.00000

A1: <!-- google_ad_client = "ca-pub-0120177304734599"; /* bottomL350x200 */ google_ad_slot = "9059344227"; google_ad_width = 300; google_ad_height = 250; //--> | C1: <!-- google_ad_client = "ca-pub-0120177304734599"; /* bottomR350x200 */ google_ad_slot = "1536077426"; google_ad_width = 300; google_ad_height = 250; //-->